municipio,nome,numero,situacao,estado
ACRELÂNDIA,SIONAYTON RODRIGUES STAUT,11,Não eleito,ac
ACRELÂNDIA,OLAVO FRANCELINO DE REZENDE,10,Eleito,ac
ASSIS BRASIL,SERGIO BATISTA DA SILVA,22,Não eleito,ac
ASSIS BRASIL,JERRY CORREIA MARINHO,11,Eleito,ac
BRASILÉIA,ANA LEILA GALVÃO MAIA MOREIRA,15,Não eleito,ac
BRASILÉIA,CARLOS ARMANDO DE SOUZA ALVES,11,Eleito,ac
BUJARI,JOÃO EDVALDO TELES DE LIMA,12,Eleito,ac
BUJARI,ROBERTO GOMES DE OLIVEIRA  FILHO,20,Não eleito,ac
BUJARI,MICHEL MARQUES ABRAHÃO,44,Não eleito,ac
CAPIXABA,SARA FRANK DE LIMA RODRIGOS,15,Não eleito,ac
CAPIXABA,MANOEL MAIA BESERRA,44,Eleito,ac
CRUZEIRO DO SUL,JOSÉ DE SOUZA LIMA,11,Eleito,ac
CRUZEIRO DO SUL,JESSICA ROJAS SALES,15,Não eleito,ac
EPITACIOLÂNDIA,ANTONIO JOSÉ SOARES DO NASCIMENTO,15,Não eleito,ac
EPITACIOLÂNDIA,SÉRGIO LOPES DE SOUZA,22,Eleito,ac
EPITACIOLÂNDIA,EVERTON SOARES DA SILVA,11,Não eleito,ac
FEIJÓ,TEREZINHA DOS SANTOS MOREIRA,22,Não eleito,ac
FEIJÓ,RAILSON FERREIRA DA SILVA,10,Eleito,ac
FEIJÓ,CLÁUDIO BRAGA LEITE,11,Não eleito,ac
FEIJÓ,CADMIEL JOSÉ ARAÚJO BOMFIM,44,Não eleito,ac
JORDÃO,NAGELA MARIA DE FIGUEIREDO SILVA,20,Não eleito,ac
JORDÃO,FRANCISCO NAUDINO RIBEIRO SOUZA,11,Eleito,ac
JORDÃO,ELSON DE LIMA FARIAS,65,Não eleito,ac
MANOEL URBANO,RAIMUNDO TOSCANO VELOZO,11,Eleito,ac
MANOEL URBANO,FRANCIMILSON RODRIGUES DA SILVA,10,Não eleito,ac
MANOEL URBANO,IZAUTE BARROSO DE SOUZA,44,Não eleito,ac
MARECHAL THAUMATURGO,ITAMAR PEREIRA DE SA,20,Não eleito,ac
MARECHAL THAUMATURGO,VALDELIO JOSE DO NASCIMENTO FURTADO,11,Eleito,ac
MÂNCIO LIMA,JOSE LUIZ GOMES DA COSTA,11,Eleito,ac
MÂNCIO LIMA,FRANCISCO RODRIGUES DE LIMA,15,Não eleito,ac
PLÁCIDO DE CASTRO,FRANCISCO TAVARES DE SOUZA,55,Não eleito,ac
PLÁCIDO DE CASTRO,CAMILO DA SILVA,11,Eleito,ac
PLÁCIDO DE CASTRO,FRANCISCO DAS CHAGAS FERREIRA HOLANDA,12,Não eleito,ac
PORTO ACRE,GILCIRLEY HONORIO RODRIGUES,10,Não eleito,ac
PORTO ACRE,JOSE MARIA RODRIGUES,20,Não eleito,ac
PORTO ACRE,KEILA MARA DA SILVA,45,Não eleito,ac
PORTO ACRE,MAXIMO ANTONIO DE SOUZA DA COSTA,11,Eleito,ac
PORTO WALTER,SEBASTIÃO NOGUEIRA DE ANDRADE,11,Eleito,ac
PORTO WALTER,ALSINEIS JOSÉ GONÇALVES DA SILVA,13,Não eleito,ac
RIO BRANCO,SEBASTIAO BOCALOM RODRIGUES,22,Eleito,ac
RIO BRANCO,EMERSON OLIVEIRA JARUDE THOMAZ,30,Não eleito,ac
RIO BRANCO,JANILSON LOPES LEITE,40,Não eleito,ac
RIO BRANCO,MARCUS ALEXANDRE MEDICI AGUIAR VIANA DA SILVA,15,Não eleito,ac
RODRIGUES ALVES,SALATIEL PINHEIRO MAGALHAES,55,Eleito,ac
RODRIGUES ALVES,FRANCISCO ERNILSON DE FREITAS,20,Não eleito,ac
RODRIGUES ALVES,FRANCISCO JARDSON FERNANDES DE SOUZA,11,Não eleito,ac
SANTA ROSA DO PURUS,ALDO RODRIGUES DE MOURA,20,Não eleito,ac
SANTA ROSA DO PURUS,JOSE ALTAMIR TAUMATURGO SÁ,15,Eleito,ac
SANTA ROSA DO PURUS,TXUA DOMINGOS HUNI KUIN,40,Não eleito,ac
SENA MADUREIRA,GILBERTO LIRA DE ALMEIDA,44,Não eleito,ac
SENA MADUREIRA,GEHLEN DINIZ ANDRADE,11,Eleito,ac
SENADOR GUIOMARD,ADONAY DE OLIVEIRA BRITO,13,Não eleito,ac
SENADOR GUIOMARD,JUCIMAR PESSOA DE SOUZA,55,Não eleito,ac
SENADOR GUIOMARD,ROSANA PEREIRA DA SILVA,11,Eleito,ac
SENADOR GUIOMARD,MOISES GOMES MOREIRA,15,Não eleito,ac
TARAUACÁ,MARIA LUCINÉIA NERY DE LIMA MENEZES,12,Não eleito,ac
TARAUACÁ,RODRIGO DAMASCENO CATÃO,11,Eleito,ac
TARAUACÁ,JOSÉ TELES DE OLIVEIRA FILHO,10,Não eleito,ac
XAPURI,ANTÔNIO PEDRO MENDONÇA,44,Não eleito,ac
XAPURI,MAXSUEL MAIA PEREIRA,11,Eleito,ac
XAPURI,ERIVELTON SOARES DA CRUZ,13,Não eleito,ac
ANADIA,PAULO VICTOR PEREIRA ROCHA,11,Eleito,al
ANADIA,AMÓS DE ALMEIDA ROCHA,40,Não eleito,al
ARAPIRACA,FABIANA CAVALCANTE PESSOA,22,Não eleito,al
ARAPIRACA,SILVIO CEZAR BALBINO DA SILVA,50,Não eleito,al
ARAPIRACA,JOSE LUCIANO BARBOSA DA SILVA,15,Eleito,al
ARAPIRACA,LINDOMAR FERREIRA DE QUEIROZ,45,Não eleito,al
ATALAIA,MAURICIO TENÓRIO DA SILVA,12,Não eleito,al
ATALAIA,LESSO BENEDITO DOS SANTOS,13,Não eleito,al
ATALAIA,MARCOS ANDRÉ MACENA ALVES,45,Não eleito,al
ATALAIA,CECILIA LIMA HERRMANN,15,Eleito,al
BARRA DE SANTO ANTÔNIO,LIVIA CARLA DA SILVA ALVES,10,Eleito,al
BARRA DE SANTO ANTÔNIO,MOACYDES CAPARICA ALEXANDRE,27,Não eleito,al
BARRA DE SANTO ANTÔNIO,EMANUELLA CORADO ACIOLI DE MOURA,15,Não eleito,al
BARRA DE SANTO ANTÔNIO,CLEBER MALTA XAVIER,44,Não eleito,al
BARRA DE SÃO MIGUEL,BENEDITO DE LIRA,11,Eleito,al
BARRA DE SÃO MIGUEL,FLORIANO DE ALBUQUERQUE MELO NETO,15,Não eleito,al
BATALHA,NELSON BEZERRA DA COSTA NETO,20,Não eleito,al
BATALHA,WAGNEY DANTAS CORREIA CAJE,15,Eleito,al
BATALHA,ALEX SANDRO ROCHA PINTO,11,Não eleito,al
BELO MONTE,MARIANA LIMA SILVA,10,Não eleito,al
BELO MONTE,DALMO AUGUSTO DE ALMEIDA JÚNIOR,15,Eleito,al
BELÉM,LUIZ HENRIQUE DAMASCENO SURUAGY,40,Não eleito,al
BELÉM,ADALBERTO ANTERO TORRES,11,Eleito,al
BOCA DA MATA,BRUNO FEIJÓ TEIXEIRA,11,Eleito,al
BOCA DA MATA,AMANDA LARISSA BARROS ACIOLI DE MOURA,40,Não eleito,al
BRANQUINHA,RAIMUNDO JOSÉ DE FREITAS LOPES,15,Eleito,al
CACIMBINHAS,WLADIMIR ARAÚJO WANDERLEY,15,Eleito,al
CAJUEIRO,JOSÉ CARLOS DA COSTA CARDOSO,13,Não eleito,al
CAJUEIRO,WELINGTON NEMESIO DE LIMA,11,Não eleito,al
CAJUEIRO,LUCILA RÉGIA ALBUQUERQUE TOLEDO,15,Eleito,al
CAMPESTRE,NELSON MENDES DA SILVA NETO,15,Eleito,al
CAMPESTRE,DEBSON BRASILIANO DA SILVA,11,Não eleito,al
CAMPO ALEGRE,PAULINE DE FÁTIMA PEREIRA ALBUQUERQUE,11,Eleito,al
CAMPO ALEGRE,HENRIQUE ANTONIO DE GOES TENORIO,15,Não eleito,al
CAMPO GRANDE,TEOGENES HIGINO MELO LESSA,40,Eleito,al
CAMPO GRANDE,ERALDO FERREIRA DA SILVA,23,Não eleito,al
CAMPO GRANDE,EDINALDO LIMA DOS SANTOS,10,Não eleito,al
CANAPI,JOSE PAULO ALVES RIBEIRO,12,Não eleito,al
CANAPI,LARA JAYNE SIQUEIRA BARBOSA MALTA BRANDÃO,13,Não eleito,al
CANAPI,JOSÉLIA MELO DE LIMA,11,Eleito,al
CAPELA,THIAGO DE MEDEIROS MOURA,15,Eleito,al
CAPELA,FERNANDO ANTONIO LUCENA MALTA,22,Não eleito,al
CARNEIROS,GENIVALDO NOVAIS AGRA,10,Não eleito,al
CARNEIROS,UBIRATANIA MARIA SANTANA,15,Eleito,al
CHÃ PRETA,MARYELLY CAVALCANTE DA SILVA,40,Não eleito,al
CHÃ PRETA,MAURICIO DE VASCONCELOS HOLANDA,15,Eleito,al
COITÉ DO NÓIA,BUENO HIGINO DE SOUZA SILVA,11,Eleito,al
COITÉ DO NÓIA,JOSÉ DE SENA NETTO,15,Não eleito,al
COLÔNIA LEOPOLDINA,DAVID MARIO FEITOSA JARDIM,22,Não eleito,al
COLÔNIA LEOPOLDINA,ALEXANDRE GILBERTO SOBREIRA,15,Eleito,al
COLÔNIA LEOPOLDINA,MARIA EULALIA MORAES MOURA,12,Não eleito,al
COQUEIRO SECO,RONALDO ALEXANDRE SILVA DOS SANTOS,12,Não eleito,al
COQUEIRO SECO,JADIELSON SILVA DO NASCIMENTO,15,Eleito,al
COQUEIRO SECO,RENATO TADEU FRAGOSO E SILVA,11,Não eleito,al
CORURIPE,MARCELO BELTRÃO SIQUEIRA,11,Eleito,al
CORURIPE,MARCOS ANTONIO LINS DOS SANTOS,23,Não eleito,al
CORURIPE,JOSÉ JAIR MARINHO DE OLIVEIRA,77,Não eleito,al
CRAÍBAS,TEÓFILO JOSÉ BARROSO PEREIRA,11,Eleito,al
CRAÍBAS,EDIEL BARBOSA LIMA,15,Não eleito,al
DELMIRO GOUVEIA,CRISTOVÃO LOPES DIAS,13,Não eleito,al
DELMIRO GOUVEIA,ELIZIANE FERREIRA COSTA LIMA,15,Eleito,al
DOIS RIACHOS,ROZINEIDE BARBOSA DE ARAÚJO CAMILO,15,Eleito,al
DOIS RIACHOS,ROSIVAN RODRIGUES DA SILVA JUNIOR,40,Não eleito,al
ESTRELA DE ALAGOAS,ARLINDO GARROTE DA SILVA NETO,11,Não eleito,al
ESTRELA DE ALAGOAS,ROBERTO FERREIRA WANDERLEY,15,Eleito,al
FEIRA GRANDE,DÁRIO ROBERTO SILVA LIRA,15,Eleito,al
FEIRA GRANDE,CRISTHIAN MESSIAS DE OLIVEIRA LIRA,11,Não eleito,al
FELIZ DESERTO,JORGE LUIS SILVA NUNES,11,Eleito,al
FELIZ DESERTO,DOUGLAS CASTRO SIMÕES LESSA,10,Não eleito,al
FELIZ DESERTO,JOSÉ MARCELO ARAÚJO LESSA  FILHO,20,Não eleito,al
FLEXEIRAS,SILVANA MARIA CAVALCANTE DA COSTA PINTO,11,Eleito,al
FLEXEIRAS,BRUNO LOUREIRO FRAGOSO,15,Não eleito,al
GIRAU DO PONCIANO,GILBERTO BEZERRA BARROS,11,Eleito,al
GIRAU DO PONCIANO,LIDIA SAMYRA DO NASCIMENTO BARROS SILVA,12,Não eleito,al
IBATEGUARA,EDJA MARIA CAVALCANTI SANTOS DE SÁ,22,Não eleito,al
IBATEGUARA,MANOEL GERAERTES ALVES CRUZ,15,Eleito,al
IGACI,JOSE PETRUCIO OLIVEIRA BARBOSA,15,Eleito,al
IGACI,ALBERES CANDIDO DA SILVA,44,Não eleito,al
IGREJA NOVA,TIAGO GOMES DOS SANTOS,15,Eleito,al
IGREJA NOVA,GERALDO NUNES CADETE NETO,44,Não eleito,al
IGREJA NOVA,MAURICIO RICHARDSON BERNARDINO DO NASCIMENTO,22,Não eleito,al
INHAPI,WELLINGTON PETRONIO MENEZES FREIRE,12,Não eleito,al
INHAPI,JOÃO ROSALVO DA SILVA,43,Não eleito,al
INHAPI,LUIZ CELSO MALTA BRANDÃO FILHO,11,Eleito,al
JACARÉ DOS HOMENS,MARIA DO SOCORRO MELO DA SILVA,15,Eleito,al
JACARÉ DOS HOMENS,JOSE ERNESTO SILVA JUNIOR,11,Não eleito,al
JACUÍPE,MARCOS VINICIUS DA SILVA FERREIRA,11,Não eleito,al
JACUÍPE,MAYARA CRISTINA CAVALCANTE DE FREITAS,15,Eleito,al
JAPARATINGA,MARIA HELENA CALAÇA CARVALHO,40,Não eleito,al
JAPARATINGA,JOSÉ SEVERINO DA SILVA,15,Eleito,al
JARAMATAIA,RICARDO MARTINS BARBOSA,15,Eleito,al
JEQUIÁ DA PRAIA,MARIA JOSE ALVES ANANIAS,22,Não eleito,al
JEQUIÁ DA PRAIA,JOSÉ ZILMO DE ALENCAR SANTOS,20,Não eleito,al
JEQUIÁ DA PRAIA,CARLOS FELIPE CASTRO JATOBA LINS,11,Eleito,al
JOAQUIM GOMES,ELIAS JOSE DA SILVA,40,Não eleito,al
JOAQUIM GOMES,RITA DE CASSIA CAVALCANTE ANDRADE DE MORAIS,15,Eleito,al
JUNDIÁ,BEROALDO RUFINO DA SILVA,22,Não eleito,al
JUNDIÁ,JORGE SILVIO LUENGO GALVÃO,15,Eleito,al
JUNQUEIRO,JOÃO JOSÉ PEREIRA FILHO,11,Não eleito,al
JUNQUEIRO,ONALDO BELTRÃO TAVARES,27,Não eleito,al
JUNQUEIRO,CICERO LEANDRO PEREIRA DA SILVA,15,Eleito,al
LAGOA DA CANOA,EDILZA ALVES DE SOUZA,11,Eleito,al
LAGOA DA CANOA,JAIR LIRA SOARES,15,Não eleito,al
LAGOA DA CANOA,JARBAS GOMES DE BARROS PEREIRA LOPES,55,Não eleito,al
LIMOEIRO DE ANADIA,JOSE VALMIR DA SILVA FILHO,12,Não eleito,al
LIMOEIRO DE ANADIA,SIDNEY VIEIRA DE SOUZA,10,Não eleito,al
LIMOEIRO DE ANADIA,JAMES MARLAN FERREIRA BARBOSA,11,Eleito,al
LIMOEIRO DE ANADIA,JOSÉ CARLOS SILVA DE ALMEIDA,50,Não eleito,al
MACEIÓ,RAFAEL DE GÓES BRITO,15,Não eleito,al
MACEIÓ,LENILDA LUNA DE ALMEIDA,80,Não eleito,al
MACEIÓ,JOAO HENRIQUE HOLANDA CALDAS,22,Eleito,al
MACEIÓ,MARINA NOBRE TENÓRIO CRISÓSTOMO,29,Não eleito,al
MACEIÓ,ANIVALDO LUIZ DA SILVA,77,Não eleito,al
MAJOR ISIDORO,ERALDO DOS SANTOS LIMA,11,Não eleito,al
MAJOR ISIDORO,THEOBALDO CAVALCANTI LINS NETTO,15,Eleito,al
MAR VERMELHO,ANDRÉ BRANDÃO DE ALMEIDA,15,Eleito,al
MARAGOGI,DANIEL MENDES DE VASCONCELOS FERREIRA,11,Eleito,al
MARAGOGI,AGENILSON DOS SANTOS SILVA,22,Não eleito,al
MARAGOGI,JAIRO MOTA XAVIER DE OLIVEIRA,10,Não eleito,al
MARAGOGI,MARCOS JOSÉ DIAS VIANA,15,Não eleito,al
MARAVILHA,JAMIS LUIT SANTANA DOS SANTOS,11,Não eleito,al
MARAVILHA,ANTÔNIO JORGE RODRIGUES,10,Eleito,al
MARECHAL DEODORO,ANDRÉ LUIZ BARROS DA SILVA,15,Eleito,al
MARECHAL DEODORO,JOSÉ GILVAN RIBEIRO DE ALMEIDA FILHO,10,Não eleito,al
MARIBONDO,BRUNO ZEFERINO DO CARMO TEIXEIRA,40,Eleito,al
MARIBONDO,JORGE ANTÔNIO AMORIM MARQUES LUZ,11,Não eleito,al
MATA GRANDE,WALLYSSON FIRMO DE HOLANDA SOARES,40,Não eleito,al
MATA GRANDE,MARIA FABIANA FARIAS DE ALENCAR,15,Eleito,al
MATRIZ DE CAMARAGIBE,FERNANDO HENRIQUE LIMA CAVALCANTE,15,Eleito,al
MATRIZ DE CAMARAGIBE,AMARO GALDINO DA SILVA,13,Não eleito,al
MATRIZ DE CAMARAGIBE,MARCOS PAULO DO NASCIMENTO,11,Não eleito,al
MESSIAS,ARY CLEYTON DE CARVALHO RÊGO,12,Não eleito,al
MESSIAS,MARCOS JOSÉ HERCULANO DA SILVA,10,Eleito,al
MESSIAS,JARBAS MAYA DE OMENA FILHO,11,Não eleito,al
MESSIAS,GEOBERTO GONÇALVES DA SILVA CORDEIRO,70,Não eleito,al
MINADOR DO NEGRÃO,JOSE EMILIO TENORIO BARROS,40,Não eleito,al
MINADOR DO NEGRÃO,JOSIAS SOARES DA SILVA,15,Eleito,al
MONTEIRÓPOLIS,LEONOR MELO MONTEIRO,15,Eleito,al
MONTEIRÓPOLIS,LIDIA DIELLY SILVA SANTOS,20,Não eleito,al
MURICI,EDUARDO CESAR DE OLIVEIRA,11,Não eleito,al
MURICI,REMI VASCONCELOS CALHEIROS FILHO,15,Eleito,al
MURICI,CAUBI DAMARA DE OMENA FREITAS FILHO,20,Não eleito,al
NOVO LINO,JOSE EDUARDO DOS SANTOS SALES,22,Não eleito,al
NOVO LINO,MARCELA SILVA GOMES DE BARROS,15,Eleito,al
OLHO D&apos;ÁGUA DAS FLORES,JOSÉ LUIZ VASCONCELLOS DOS ANJOS,15,Eleito,al
OLHO D&apos;ÁGUA DAS FLORES,CLAUDEVAN FERREIRA ROCHA,77,Não eleito,al
OLHO D&apos;ÁGUA DAS FLORES,ALYSON FELIX DUARTE DANTAS,22,Não eleito,al
OLHO D&apos;ÁGUA DO CASADO,CARLOS ALBERTO BEZERRA DA SILVA,13,Eleito,al
OLHO D&apos;ÁGUA DO CASADO,JOSE MESSIAS DIAS DOS SANTOS,77,Não eleito,al
OLHO D&apos;ÁGUA DO CASADO,MARCOS VIEIRA SOUSA,15,Não eleito,al
OLHO D&apos;ÁGUA GRANDE,TEREZA DE FATIMA BARBOSA CEDRIM,10,Não eleito,al
OLHO D&apos;ÁGUA GRANDE,MARIA SUZANICE HIGINO BAHÉ,11,Eleito,al
OLIVENÇA,JORGINALDO VIEIRA DE MENESES,10,Não eleito,al
OLIVENÇA,JOSIMAR DIONISIO,15,Eleito,al
OURO BRANCO,ATEVALDO CABRAL SILVA,15,Não eleito,al
OURO BRANCO,TACIA DENYSE DE SIQUEIRA NOBRE,11,Eleito,al
PALESTINA,DINO CÉSAR DO NASCIMENTO,11,Não eleito,al
PALESTINA,JOSÉ DJALMA GONÇALVES DA SILVA,15,Eleito,al
PALMEIRA DOS ÍNDIOS,MOSABELLE RODRIGUES BRASILEIRO MONTEIRO,10,Não eleito,al
PALMEIRA DOS ÍNDIOS,GERVÁSIO RAIMUNDO DOS SANTOS NETO,25,Não eleito,al
PALMEIRA DOS ÍNDIOS,CRISTIANO ÁVILA RAMOS FERREIRA,12,Não eleito,al
PALMEIRA DOS ÍNDIOS,LUISA JULIA DUARTE,15,Eleito,al
PARICONHA,PEDRO PEREIRA DE SÁ JUNIOR,13,Não eleito,al
PARICONHA,ANTONIO TELMO NOIA,15,Eleito,al
PARIPUEIRA,EDVANIO DE LIMA SANTOS,10,Não eleito,al
PARIPUEIRA,CARLOS ABRAHÃO GOMES DE MOURA,15,Eleito,al
PASSO DE CAMARAGIBE,ELLISSON SANTOS DA SILVA,10,Eleito,al
PASSO DE CAMARAGIBE,MARIA LAVÍNIA FARIAS QUIRINO COSTA,15,Não eleito,al
PAULO JACINTO,FABRICIO BERTO FAUSTINO,40,Não eleito,al
PAULO JACINTO,FRANCISCO MANOEL FERREIRA FONTAN,11,Eleito,al
PENEDO,MARCIUS BELTRÃO SIQUEIRA,12,Não eleito,al
PENEDO,RONALDO PEREIRA LOPES,15,Eleito,al
PIAÇABUÇU,KAYRO CRISTÓVÃO CASTRO DOS SANTOS,11,Não eleito,al
PIAÇABUÇU,ANTONINO CARDOZO DE CARVALHO,40,Não eleito,al
PIAÇABUÇU,RYMES MARINHO LESSA,15,Eleito,al
PILAR,MARIA DE FATIMA RESENDE ROCHA OITICICA,15,Eleito,al
PILAR,THAIS VIANA DE MENDONÇA CANUTO,12,Não eleito,al
PILAR,ROBERTO DOUGLAS DA SILVA BARROS,43,Não eleito,al
PILAR,ADRIANO MARCELO OMENA COSTA,22,Não eleito,al
PINDOBA,JOSÉ MAURICIO TENÓRIO CAVALCANTE,11,Não eleito,al
PINDOBA,JOSÉ CICERO CARDOSO COSTA,10,Eleito,al
PIRANHAS,TIAGO TORRES FREITAS,15,Eleito,al
PIRANHAS,MARISTELA SENA DIAS,11,Não eleito,al
PORTO CALVO,KLEVISSON KENNEDY DA SILVA SIQUEIRA,11,Não eleito,al
PORTO CALVO,JEFFERSON RODRIGUES DA SILVA,22,Não eleito,al
PORTO CALVO,ERONITA SPOSITO LEAO E LIMA,15,Eleito,al
PORTO DE PEDRAS,LUIZ CARLOS BORGHETTI ROCHA,11,Não eleito,al
PORTO DE PEDRAS,ALLAN DE JESUS SILVA,15,Eleito,al
PORTO DE PEDRAS,BENEDITO FABIO DOS SANTOS,77,Não eleito,al
PORTO REAL DO COLÉGIO,JOSÉ TIAGO DE LIRA,40,Não eleito,al
PORTO REAL DO COLÉGIO,HIGOR JOSÉ SANTOS FREITAS,11,Eleito,al
POÇO DAS TRINCHEIRAS,MARCELO MELO SILVA,12,Não eleito,al
POÇO DAS TRINCHEIRAS,JOSE VALMIRO GOMES DA COSTA,15,Eleito,al
POÇO DAS TRINCHEIRAS,CAIO CÉSAR FERREIRA RODRIGUES,11,Não eleito,al
PÃO DE AÇÚCAR,JORGE SILVA DANTAS,15,Eleito,al
PÃO DE AÇÚCAR,ALDO ALVES ROSA,22,Não eleito,al
PÃO DE AÇÚCAR,CLIUTON SANTOS,13,Não eleito,al
QUEBRANGULO,EMANOEL CARDOSO DE ALBUQUERQUE,15,Não eleito,al
QUEBRANGULO,EDUARDO JOSÉ TENÓRIO HOLANDA DE OLIVEIRA,40,Não eleito,al
QUEBRANGULO,MANOEL COSTA TENÓRIO,45,Eleito,al
RIO LARGO,PEDRO CARLOS DA SILVA NETO,11,Eleito,al
RIO LARGO,SILVANO VIEIRA DOS SANTOS,13,Não eleito,al
RIO LARGO,IVAN ALEXANDRINO PAES,77,Não eleito,al
RIO LARGO,ANNY IZABELLE TORRES MELO LINS DE SOUZA,12,Não eleito,al
RIO LARGO,PEDRO VICTOR DE ARAUJO JUNIOR,15,Não eleito,al
RIO LARGO,ROMILDO ELIAS CALHEIROS JUNIOR,22,Não eleito,al
ROTEIRO,THIAGO HENRIQUE TEIXEIRA CURSINO,22,Não eleito,al
ROTEIRO,MARIA CICERA DOS SANTOS FILHA ALVES,18,Não eleito,al
ROTEIRO,PAULO JOSÉ LEITE TEIXEIRA,15,Eleito,al
SANTA LUZIA DO NORTE,MARIA JOSÉ DOS SANTOS,80,Não eleito,al
SANTA LUZIA DO NORTE,FRANCIS CORREIA BARROS DE ARAÚJO,11,Eleito,al
SANTA LUZIA DO NORTE,WERDLEY THIAGO SILVA AMARAL,15,Não eleito,al
SANTANA DO IPANEMA,JOSE EDSON MAGALHÃES FELIX,11,Não eleito,al
SANTANA DO IPANEMA,ALBÉRIO WANDERLEY DE AQUINO,44,Não eleito,al
SANTANA DO IPANEMA,JOAO EDUARDO BULHOES PORTELA DE MELO,15,Eleito,al
SANTANA DO MUNDAÚ,EDNO LINO DA SILVA,22,Não eleito,al
SANTANA DO MUNDAÚ,ANDRÉ LUIZ GOES CASTRO,15,Eleito,al
NOVA IBIÁ,MARCIO TARANTINE SOUZA SAMPAIO,70,Eleito,ba
NOVA IBIÁ,BRUNO SOUZA DA SILVA,15,Não eleito,ba
NOVA ITARANA,ELMO RICARDO GALVAO DE SOUZA  SILVA,55,Eleito,ba
NOVA ITARANA,EDUARDO ALVES DA SILVA,15,Não eleito,ba
NOVA REDENÇÃO,RODRIGO DA SILVA RIBEIRO,13,Não eleito,ba
NOVA REDENÇÃO,ADEMAR MARTINS DE OLIVEIRA FILHO,55,Eleito,ba
NOVA SOURE,ALAN CAMILO BARRETO REIS,55,Eleito,ba
NOVA SOURE,JOSÉ ARIVALDO FERREIRA SOARES,15,Não eleito,ba
NOVA VIÇOSA,LUCIANA SOUSA MACHADO RODRIGUES,44,Eleito,ba
NOVA VIÇOSA,ROGERIO DE SOUZA BENJAMIM,55,Não eleito,ba
NOVO HORIZONTE,ROGERIO DE OLIVEIRA PRADO,55,Eleito,ba
NOVO HORIZONTE,ADEMAR MENDES DOS SANTOS,44,Não eleito,ba
NOVO TRIUNFO,RONILDO DE OLIVEIRA MATOS,20,Não eleito,ba
NOVO TRIUNFO,MATHEUS BARROS DE SANTANA,11,Eleito,ba
OLINDINA,LUIZ ALBERTO ARAÚJO DANTAS FILHO,55,Eleito,ba
OLINDINA,ADELMO DO NASCIMENTO SOUZA,70,Não eleito,ba
OLIVEIRA DOS BREJINHOS,CLERISTON UAIDE REIS GUEDES PEREIRA,13,Eleito,ba
OLIVEIRA DOS BREJINHOS,SILVANDO BRITO SANTOS,55,Não eleito,ba
OURIÇANGAS,TARCISIO LIMA DE CERQUEIRA,15,Não eleito,ba
OURIÇANGAS,SIMONE DOS SANTOS,70,Não eleito,ba
OURIÇANGAS,RONIVALDO CERQUEIRA DE ARAÚJO,13,Eleito,ba
OUROLÂNDIA,JOSÉ RAIMUNDO ARAUJO DE SOUZA,44,Eleito,ba
OUROLÂNDIA,YHONARA ROCHA DE ALMEIDA FREIRE,13,Não eleito,ba
OUROLÂNDIA,JOSÉ CARLOS RIBEIRO DOS SANTOS,15,Não eleito,ba
PALMAS DE MONTE ALTO,WILSON LIMA NASCIMENTO,15,Não eleito,ba
PALMAS DE MONTE ALTO,FERNANDO NOGUEIRA LARANJEIRA,70,Não eleito,ba
PALMAS DE MONTE ALTO,JOÃO PEDRO ROCHA DE MOURA OLIVEIRA,40,Não eleito,ba
PALMAS DE MONTE ALTO,MARCOS TULIO LARANJEIRA ROCHA,55,Eleito,ba
PALMEIRAS,MARCOS VENÍCIOS SANTOS TELES,55,Não eleito,ba
PALMEIRAS,WILSON JOSE DA ROCHA,70,Eleito,ba
PARAMIRIM,JULIO BERNARDO BRITO VIEIRA BITTENCOURT,55,Não eleito,ba
PARAMIRIM,OSÓRIO DOS ANJOS OLIVEIRA,20,Não eleito,ba
PARAMIRIM,JOÃO RICARDO BRASIL MATOS,70,Eleito,ba
PARATINGA,EUGÊNIO DE MOURA ROCHA,12,Não eleito,ba
PARATINGA,VITOR FERREIRA DE SANTANA,13,Eleito,ba
PARATINGA,MARCELO RODRIGUES DOS SANTOS,70,Não eleito,ba
PARATINGA,MARIVALDO DE OLIVEIRA,22,Não eleito,ba
PARIPIRANGA,GEORGE ROBERTO RIBEIRO NASCIMENTO,15,Não eleito,ba
PARIPIRANGA,TALISSON SANTA ROSA NASCIMENTO,55,Eleito,ba
PAU BRASIL,RODRIGO SILVA MENDES,70,Não eleito,ba
PAU BRASIL,ROBSON VENÂNCIO DO NASCIMENTO,13,Eleito,ba
PAULO AFONSO,ONILDE CAVALCANTE DE ANDRADE CARVALHO,30,Não eleito,ba
PAULO AFONSO,JULIANO MARCIO DE MEDEIROS NOGUEIRA,10,Não eleito,ba
PAULO AFONSO,MARCONI DANIEL MELO ALENCAR,13,Não eleito,ba
PAULO AFONSO,MARIO CESAR BARRETO AZEVEDO,55,Eleito,ba
PAULO AFONSO,MARCONDES FRANCISCO DOS SANTOS,11,Não eleito,ba
PAULO AFONSO,JOSÉ OLIVEIRA MOTA,18,Não eleito,ba
PEDRO ALEXANDRE,PEDRO GOMES FILHO,55,Não eleito,ba
PEDRO ALEXANDRE,YURI CESAR DE ANDRADE MENEZES,11,Eleito,ba
PEDRO ALEXANDRE,LAZARO DE JESUS SANTOS,15,Não eleito,ba
PEDRÃO,LUIZ CARLOS BASTOS PRATA,11,Não eleito,ba
PEDRÃO,MARCILIO MENEZES,15,Eleito,ba
PIATÃ,MARCOS PAULO SANTOS AZEVEDO,55,Eleito,ba
PIATÃ,SEBASTIÃO THIAGO CARVALHO DULTRA FILHO,40,Não eleito,ba
PILÃO ARCADO,GUARABIRA QUEIROZ LIMA,33,Não eleito,ba
PILÃO ARCADO,LEOSMIR ATANAZIO GAMA,13,Eleito,ba
PILÃO ARCADO,LUIZ ROGERIO DIAS DA SILVA,55,Não eleito,ba
PINDAÍ,IONALDO AURELIO PRATES,70,Não eleito,ba
PINDAÍ,JOÃO EVANGELISTA VEIGA PEREIRA,11,Eleito,ba
PINDOBAÇU,DAVID MENEZES FARIAS,55,Eleito,ba
PINDOBAÇU,RUI MANOEL RIBEIRO CAMACAN FILHO,15,Não eleito,ba
PINTADAS,VALCYR ALMEIDA RIOS,13,Eleito,ba
PINTADAS,ROGÉRIO EPIFÂNIO DE ALMEIDA,70,Não eleito,ba
PIRAÍ DO NORTE,ULYSSES ARAÚJO DE MENEZES VEIGA,13,Não eleito,ba
PIRAÍ DO NORTE,HELITON FABIANO TAVARES DA SILVA PEREIRA,11,Eleito,ba
PIRAÍ DO NORTE,IOSSIMARA NUNES SILVA,50,Não eleito,ba
PIRIPÁ,ADRIANO PEREIRA BILAC,70,Não eleito,ba
PIRIPÁ,CRISTIANO SANTOS SILVA,55,Eleito,ba
PIRITIBA,MOISES DIAS FERREIRA,15,Não eleito,ba
PIRITIBA,LEANDRA BELITARDO BARRETTO DE ANDRADE LIMA,77,Eleito,ba
PIRITIBA,URIVAL LIMA SOUZA FILHO,22,Não eleito,ba
PLANALTINO,JOSEVAL ALVES BRAGA,55,Não eleito,ba
PLANALTINO,RONALDO LISBOA DA SILVA,13,Eleito,ba
PLANALTINO,EVANILDO JOSEMAR FERREIRA RIBEIRO,44,Não eleito,ba
PLANALTO,EDILSON DUARTE DA CUNHA,11,Não eleito,ba
PLANALTO,CLOVES ALVES ANDRADE,13,Eleito,ba
POJUCA,ADRIANO DOS SANTOS CARDOSO,40,Não eleito,ba
POJUCA,EDMAR CORDARA FARIAS,70,Não eleito,ba
POJUCA,CARLOS EDUARDO UMBELINO DOS SANTOS,77,Não eleito,ba
POJUCA,LUIZ CARLOS COSTA TRINCHÃO,55,Eleito,ba
PONTO NOVO,JOSE VENANCIO SOBRINHO,15,Não eleito,ba
PONTO NOVO,FABIANE AZEVEDO MAIA DE OLIVEIRA,55,Eleito,ba
PORTO SEGURO,GABRIELLA BORGES DE SOUZA,50,Não eleito,ba
PORTO SEGURO,CLÁUDIA SILVA SANTOS OLIVEIRA,55,Não eleito,ba
PORTO SEGURO,JANIO NATAL ANDRADE BORGES,22,Eleito,ba
PORTO SEGURO,ALYSON MONTEZANO DE FREITAS,30,Não eleito,ba
PORTO SEGURO,LUIGI ROTUNNO,45,Não eleito,ba
POTIRAGUÁ,ELIAS DE CARVALHO FILHO,70,Eleito,ba
POTIRAGUÁ,MAURICIO FILHO PORTUGAL,55,Não eleito,ba
POTIRAGUÁ,TONISLEI SANTA CRUZ DO NASCIMENTO,18,Não eleito,ba
POÇÕES,LUCIANO ARAUJO MASCARENHAS,55,Não eleito,ba
POÇÕES,IRENILDA CUNHA DE MAGALHÃES,65,Eleito,ba
POÇÕES,DIOGO CHULÚ COSTA LETO,30,Não eleito,ba
PRADO,WILSON ALVES DE BRITO FILHO,11,Não eleito,ba
PRADO,ELIVALDO DA SILVA COSTA,22,Não eleito,ba
PRADO,GILVAN DA SILVA SANTOS,55,Eleito,ba
PRESIDENTE DUTRA,ZOROELIO PEREIRA MACHADO,55,Não eleito,ba
PRESIDENTE DUTRA,ROBERTO CARLOS ALVES DE SOUZA,15,Eleito,ba
PRESIDENTE JÂNIO QUADROS,LELIO ALVES BRITO JUNIOR,13,Eleito,ba
PRESIDENTE JÂNIO QUADROS,CELSO DA ROCHA TEIXEIRA,70,Não eleito,ba
PRESIDENTE JÂNIO QUADROS,MIGUEL DE OLIVEIRA,15,Não eleito,ba
PRESIDENTE TANCREDO NEVES,NEDILZA MASCARENHAS DE SANTANA,35,Não eleito,ba
PRESIDENTE TANCREDO NEVES,JOÃO SANTANA NETO,55,Não eleito,ba
PRESIDENTE TANCREDO NEVES,JOSUE PAULO DOS SANTOS FILHO,70,Eleito,ba
PÉ DE SERRA,ZEDIVAN DE FREITAS RIOS,44,Eleito,ba
PÉ DE SERRA,EDGAR CARNEIRO MIRANDA,55,Não eleito,ba
QUEIMADAS,CLEMENTINO JOSE DOS SANTOS RODRIGUES,13,Não eleito,ba
QUEIMADAS,RICARDO MARCOS BATISTA LOPES,55,Eleito,ba
QUIJINGUE,SAULO RODRIGO SANTANA CARDOSO,13,Não eleito,ba
QUIJINGUE,JOSÉ ROMERO ROCHA MATOS FILHO,70,Eleito,ba
QUIXABEIRA,AELSON DE OLIVEIRA ALMEIDA,13,Não eleito,ba
QUIXABEIRA,EDINALDO OLIVEIRA RIOS,44,Eleito,ba
RAFAEL JAMBEIRO,CIBELE OLIVEIRA DE CARVALHO,13,Não eleito,ba
RAFAEL JAMBEIRO,MARINALVO FERNANDES SERRA,44,Eleito,ba
REMANSO,MARCOS CARVALHO PALMEIRA,65,Eleito,ba
REMANSO,PEDRO PAULO MARIANO ROSAL MARTINS,55,Não eleito,ba
RETIROLÂNDIA,NAYARA CUNHA DA SILVA,13,Não eleito,ba
RETIROLÂNDIA,JOSÉ EGNILDO DOS SANTOS,40,Eleito,ba
RIACHO DE SANTANA,JOAO VITOR MARTINS LARANJEIRA,55,Eleito,ba
RIACHO DE SANTANA,ALAN ANTONIO VIEIRA,15,Não eleito,ba
RIACHÃO DAS NEVES,MOAB NASCIMENTO DE SANTANA,10,Eleito,ba
RIACHÃO DAS NEVES,JONNICLEI SILVA DOS SANTOS,55,Não eleito,ba
RIACHÃO DO JACUÍPE,ESAU DA SILVA,15,Não eleito,ba
RIACHÃO DO JACUÍPE,JUAREZ OLIVEIRA CARNEIRO,18,Não eleito,ba
RIACHÃO DO JACUÍPE,JOSÉ CARLOS DE MATOS SOARES,44,Eleito,ba
RIACHÃO DO JACUÍPE,JOSE RAMIRO FERREIRA FILHO,55,Não eleito,ba
RIBEIRA DO AMPARO,LOURIVAL HIGINO DA SILVA FILHO,13,Não eleito,ba
RIBEIRA DO AMPARO,TETIANA DE PAULA FONTES CEDRO BRITTO,15,Eleito,ba
RIBEIRA DO POMBAL,ERIKSSON SANTOS SILVA,15,Eleito,ba
RIBEIRA DO POMBAL,BRENNO DE MELO GOMES CALASANS,11,Não eleito,ba
RIBEIRÃO DO LARGO,HIGO LOPES ROCHA,20,Não eleito,ba
RIBEIRÃO DO LARGO,ANDRÉ LUIS ALVES MEDEIROS,40,Não eleito,ba
RIBEIRÃO DO LARGO,JESUINA MOREIRA BORGES,70,Eleito,ba
RIO DE CONTAS,CELIO EVANGELISTA DA SILVA,55,Eleito,ba
RIO DE CONTAS,ILZINETE PIRES CORREIA DA SILVA,70,Não eleito,ba
RIO DO ANTÔNIO,MARCÍLIO GLAUBER RODRIGUES MENDES,10,Não eleito,ba
RIO DO ANTÔNIO,GERSON DE SOUZA RIBEIRO,40,Eleito,ba
RIO DO PIRES,HYRAN MICHEL MENDONÇA MARQUES,55,Não eleito,ba
RIO DO PIRES,JOSE MARCOS PEREIRA,70,Eleito,ba
RIO REAL,GIANCARLO ALVES DE ALCANTARA SOUZA,43,Eleito,ba
RIO REAL,JOSEANE DA SILVA GUIMARÃES DO NASCIMENTO,70,Não eleito,ba
RIO REAL,HENIO LUCAS SANTOS CARDOSO,11,Não eleito,ba
RODELAS,GERALDO JACKSON MENEZES LIMA,11,Não eleito,ba
RODELAS,EMANUEL RODRIGUES FERREIRA,65,Eleito,ba
RUY BARBOSA,SAULO ROBERIO LEAL DIAS,44,Não eleito,ba
RUY BARBOSA,MARIVALDO LEITE NASCIMENTO,55,Não eleito,ba
RUY BARBOSA,JOSÉ BONIFÁCIO MARQUES DOURADO,15,Não eleito,ba
RUY BARBOSA,WEBSTON ANDRADE DA SILVA,12,Não eleito,ba
SALINAS DA MARGARIDA,MARLETH SANTOS DIAS,70,Não eleito,ba
SALINAS DA MARGARIDA,MARIA DE FÁTIMA PÊPE CERQUEIRA,55,Eleito,ba
SALINAS DA MARGARIDA,MANOEL DIAS DE ALBUQUERQUE FILHO,15,Não eleito,ba
SALVADOR,SILVANO ALVES DE SOUZA,29,Não eleito,ba
SALVADOR,BRUNO SOARES REIS,44,Eleito,ba
SALVADOR,VICTOR BRUNO MARINHO PEREIRA,16,Não eleito,ba
SALVADOR,KLEBER ROSA DE SOUZA,50,Não eleito,ba
SALVADOR,ESLANE SILVA DA PAIXÃO,80,Não eleito,ba
SALVADOR,GERALDO ALVES FERREIRA JÚNIOR,15,Não eleito,ba
SALVADOR,GIOVANI DAMICO,21,Não eleito,ba
SANTA BRÍGIDA,CARLOS CLERISTON SANTANA GOMES,13,Não eleito,ba
SANTA BRÍGIDA,EDJANIO DA SILVA MARTINS,55,Não eleito,ba
SANTA BRÍGIDA,ELTON CARLOS MAGALHÃES,20,Eleito,ba
SANTA BÁRBARA,ENOCK GOMES DE JESUS,35,Não eleito,ba
SANTA BÁRBARA,GESSE ESTRELA PINHEIRO,13,Não eleito,ba
SANTA BÁRBARA,EDIFRANCIO DE JESUS OLIVEIRA,55,Eleito,ba
SANTA CRUZ CABRÁLIA,ISZAEL FERNANDES GOMES,13,Não eleito,ba
SANTA CRUZ CABRÁLIA,AZIZ ALBERTO RAMOS SANTOS FILHO,33,Não eleito,ba
SANTA CRUZ CABRÁLIA,GIRLEI LIMA NAZARETH,12,Eleito,ba
SANTA CRUZ CABRÁLIA,CARLOS DE JESUS VIEIRA,20,Não eleito,ba
SANTA CRUZ CABRÁLIA,LOREDANO ALEIXO PEREIRA DOS SANTOS JUNIOR,44,Não eleito,ba
SANTA CRUZ DA VITÓRIA,JACKSON BONFIM DE CASTRO,13,Não eleito,ba
SANTA CRUZ DA VITÓRIA,MAURÍCIO LOPES DOS SANTOS,55,Eleito,ba
SANTA INÊS,SANDRO SANTOS SILVA,13,Eleito,ba
SANTA INÊS,JULIANA DOS SANTOS FERREIRA NETA,36,Não eleito,ba
SANTA LUZIA,FERNANDO SCHUELER BRITO,70,Eleito,ba
SANTA LUZIA,CINARA ASSIS SANTOS,55,Não eleito,ba
SANTA MARIA DA VITÓRIA,ANTONIO ELSON MARQUES DA SILVA,44,Eleito,ba
