municipio,nome,numero,situacao,estado
SÃO JOSÉ DO EGITO,FREDSON HENRIQUE DE OLIVEIRA BRITO,10,Eleito,pe
SÃO JOÃO,JOSÉ GENALDI FERREIRA ZUMBA,10,Não eleito,pe
SÃO JOÃO,JOSE WILSON FERREIRA DE LIMA,11,Eleito,pe
SÃO LOURENÇO DA MATA,JAIRO PEREIRA DE OLIVEIRA,45,Não eleito,pe
SÃO LOURENÇO DA MATA,VINICIUS LABANCA,40,Eleito,pe
SÃO VICENTE FÉRRER,FLÁVIO TRAVASSOS REGIS DE ALBUQUERQUE,15,Não eleito,pe
SÃO VICENTE FÉRRER,MARCONE VICENTE DOS SANTOS,11,Eleito,pe
TABIRA,FLÁVIO FERREIRA MARQUES,13,Eleito,pe
TABIRA,MARIA CLAUDENICE PEREIRA DE MELO CRISTÓVÃO,11,Não eleito,pe
TACAIMBÓ,JOELDA LIMA DA SILVA PEREIRA,45,Eleito,pe
TACAIMBÓ,EDVALDO JOÃO DA SILVA,13,Não eleito,pe
TACARATU,JOSÉ GERSON DA SILVA JÚNIOR,40,Não eleito,pe
TACARATU,WASHINGTON ANGELO DE ARAÚJO,15,Eleito,pe
TAMANDARÉ,JOSÉ HILDO HACKER JÚNIOR,55,Não eleito,pe
TAMANDARÉ,ISAIAS HONORATO DA SILVA MARQUES,10,Eleito,pe
TAQUARITINGA DO NORTE,GENIVALDO FERREIRA LINS,11,Eleito,pe
TAQUARITINGA DO NORTE,JOBSON LUÍS MELO DE NEGREIROS,44,Não eleito,pe
TAQUARITINGA DO NORTE,JÂNIO ARRUDA DA SILVA,55,Não eleito,pe
TAQUARITINGA DO NORTE,ALLYSON RYCHARDSON BARBOSA,45,Não eleito,pe
TEREZINHA,ARNOBIO GOMES DA SILVA,10,Eleito,pe
TEREZINHA,ADRIANO CAMPOS DA SILVA,55,Não eleito,pe
TERRA NOVA,MAURÍCIO MANOEL DA SILVA,44,Não eleito,pe
TERRA NOVA,ESDRAS ENILDO PIRES DE CARVALHO COELHO MORORÓ,70,Eleito,pe
TIMBAÚBA,JEFFERSON LUIZ FIGUEIREDO LEAL,44,Não eleito,pe
TIMBAÚBA,MARIA DA CONCEIÇÃO ALESSANDRA SILVA DE SANTANA,45,Não eleito,pe
TIMBAÚBA,ULISSES FELINTO FILHO,10,Não eleito,pe
TIMBAÚBA,MARINALDO ROSENDO DE ALBUQUERQUE,11,Eleito,pe
TORITAMA,ROMERO ALEXANDRE SILVA LEAL FERREIRA,45,Não eleito,pe
TORITAMA,JOSÉ MARCELO MARQUES DE ANDRADE E SILVA,13,Não eleito,pe
TORITAMA,SERGIO PROCOPIO DA SILVA CARVALHO,15,Eleito,pe
TRACUNHAÉM,SEVERINO JOSE DE OLIVEIRA,50,Não eleito,pe
TRACUNHAÉM,ALUIZIO XAVIER DA SILVA,55,Eleito,pe
TRACUNHAÉM,BELARMINO VASQUEZ MENDEZ NETO,40,Não eleito,pe
TRINDADE,JOSE LOPES BENÍCIO,55,Não eleito,pe
TRINDADE,HELBE DA SILVA RODRIGUES NASCIMENTO,44,Eleito,pe
TRIUNFO,EDVALDO LIMA DO NASCIMENTO,10,Não eleito,pe
TRIUNFO,ANTÔNIO EDUARDO DE MELO,20,Não eleito,pe
TRIUNFO,LUCIANO FERNANDO DE SOUSA,45,Eleito,pe
TUPANATINGA,DIEGO TEIXEIRA CAVALCANTI MINERVINO,13,Não eleito,pe
TUPANATINGA,EDILEUZO RODRIGUES BARBOSA,50,Não eleito,pe
TUPANATINGA,JOSÉ RONALDO DA SILVA,11,Eleito,pe
TUPANATINGA,VALMIR ALVES DOS SANTOS,55,Não eleito,pe
TUPARETAMA,IVAÍ CAVALCANTE DA SILVA,13,Não eleito,pe
TUPARETAMA,DIÓGENES TORRES DA COSTA PATRIOTA,45,Eleito,pe
TUPARETAMA,DANILO AUGUSTO OLIVEIRA PEREIRA NUNES,70,Não eleito,pe
VENTUROSA,ERNANDES ALBUQUERQUE BEZERRA,22,Não eleito,pe
VENTUROSA,KELVIN DOUGLAS CAVALCANTI ALMEIDA,55,Eleito,pe
VENTUROSA,ADRIANNO ALEXANDRE GALINDO BEZERRA,10,Não eleito,pe
VERDEJANTE,FRANCISCO ALVES TAVARES DE SÁ,55,Não eleito,pe
VERDEJANTE,FRANCISCO DE ASSIS TAVARES FILHO,45,Eleito,pe
VERTENTE DO LÉRIO,FÁBIO DA SILVA FRANÇA,11,Não eleito,pe
VERTENTE DO LÉRIO,HISTÊNIO JÚNIOR DA SILVA SALES,15,Eleito,pe
VERTENTES,ISRAEL FERREIRA DE ANDRADE,45,Eleito,pe
VERTENTES,JOSE BARROS DA SILVA NETO,40,Não eleito,pe
VICÊNCIA,EDER WALTTER JOSÉ DE OLIVEIRA SILVA,45,Eleito,pe
VICÊNCIA,SEVERINO DE OLIVEIRA VASCONCELOS NETO,40,Não eleito,pe
VITÓRIA DE SANTO ANTÃO,ANDRE CARVALHO DE MOURA,12,Não eleito,pe
VITÓRIA DE SANTO ANTÃO,PAULO ROBERTO LEITE DE ARRUDA,15,Eleito,pe
VITÓRIA DE SANTO ANTÃO,VICTOR MORAES QUERALVARES GLASER,40,Não eleito,pe
XEXÉU,EUDO DE MAGALHÃES LYRA,40,Não eleito,pe
XEXÉU,THIAGO GONÇALVES DE LIMA,55,Eleito,pe
ÁGUA PRETA,ANTONIO MARCOS DE MELO FRAGOSO LIMA,11,Não eleito,pe
ÁGUA PRETA,ANTONIO MANOEL DA SILVA,40,Eleito,pe
ÁGUAS BELAS,MAURICIO LEITE BARBOZA,13,Não eleito,pe
ÁGUAS BELAS,JOSÉ ELTON MARTINS DE SOUZA,10,Eleito,pe
ACAUÃ,JOSÉ GREGÓRIO COELHO JÚNIOR,13,Não eleito,pi
ACAUÃ,REGINALDO RAIMUNDO RODRIGUES,55,Eleito,pi
AGRICOLÂNDIA,JANETH CLÉA RIBEIRO DE ALENCAR BARRADAS,13,Não eleito,pi
AGRICOLÂNDIA,MARCOS ANTONIO CARVALHO DE SOUSA,15,Eleito,pi
ALAGOINHA DO PIAUÍ,PEDRO OTACILIO DE SOUSA MOURA,55,Eleito,pi
ALAGOINHA DO PIAUÍ,CLODOALDO DE MOURA ROCHA,13,Não eleito,pi
ALEGRETE DO PIAUÍ,MARCIO WILLIAN MAIA ALENCAR,13,Eleito,pi
ALEGRETE DO PIAUÍ,MANOEL JOÃO RAMOS FILHO,15,Não eleito,pi
ALTO LONGÁ,BELAUTO MOREIRA TORRES,13,Eleito,pi
ALTO LONGÁ,ISAAC MANOEL DA SILVA SOARES,55,Não eleito,pi
ALTOS,WARTON MATIAS LACERDA E OLIVEIRA,13,Não eleito,pi
ALTOS,MAXWELL PIRES FERREIRA,15,Eleito,pi
ALVORADA DO GURGUÉIA,LECIO GUSTAVO SOUSA BEZERRA,15,Eleito,pi
ALVORADA DO GURGUÉIA,LUIS RIBEIRO MARTINS,55,Não eleito,pi
AMARANTE,ADRIANO DA GUIA DA SILVA,10,Eleito,pi
AMARANTE,CLEMILTON LUIZ QUEIROZ GRANJA,13,Não eleito,pi
ANGICAL DO PIAUÍ,CASSIANO RICARDO ALMEIDA DA SILVA,55,Não eleito,pi
ANGICAL DO PIAUÍ,JOSE ANDERSON DE SOUSA ALENCAR,10,Não eleito,pi
ANGICAL DO PIAUÍ,BRUNO FERREIRA SOBRINHO NETO,15,Eleito,pi
ANTÔNIO ALMEIDA,MARCELO TOLEDO LAURINI,15,Eleito,pi
ANÍSIO DE ABREU,RAMON RUBEN DE MACÊDO,13,Eleito,pi
ANÍSIO DE ABREU,LOURINALDO RIBEIRO DE MACÊDO,22,Não eleito,pi
ANÍSIO DE ABREU,ILTON RIBEIRO,11,Não eleito,pi
AROAZES,JOAQUIM JOSÉ DA COSTA FILHO,20,Não eleito,pi
AROAZES,MANOEL PORTELA DE CARVALHO NETO,13,Eleito,pi
AROEIRAS DO ITAIM,FRANCISCO MARCIANO MACEDO,55,Eleito,pi
AROEIRAS DO ITAIM,WESLEY GONÇALVES DE DEUS,15,Não eleito,pi
ARRAIAL,ALDEMES BARROSO DA SILVA,11,Eleito,pi
ARRAIAL,LAECYO MARINHO DA SILVA BORGES,55,Não eleito,pi
ASSUNÇÃO DO PIAUÍ,JOVELINO SOARES DA SILVA,55,Eleito,pi
ASSUNÇÃO DO PIAUÍ,JACKSON KENNEDY DE MELO CAVALCANTE,13,Não eleito,pi
AVELINO LOPES,DIOSTENES JOSE ALVES,11,Não eleito,pi
AVELINO LOPES,FLÁVIO JOSÉ ALVES,15,Eleito,pi
BAIXA GRANDE DO RIBEIRO,OZIRES CASTRO SILVA,40,Não eleito,pi
BAIXA GRANDE DO RIBEIRO,JOSÉ LUIS SOUSA,13,Eleito,pi
BARRA D&apos;ALCÂNTARA,MARDONIO SOARES LOPES,15,Eleito,pi
BARRAS,ROBERT BROWN CARCARÁ DA SILVA,13,Não eleito,pi
BARRAS,VINICIO DE SOUSA SILVA,15,Não eleito,pi
BARRAS,EDILSON SÉRVULO DE SOUSA,55,Eleito,pi
BARREIRAS DO PIAUÍ,MANOEL AROLDO BARREIRA FILHO,13,Eleito,pi
BARREIRAS DO PIAUÍ,ANA BARREIRA SERAINE,11,Não eleito,pi
BARRO DURO,ANTÔNIA CLEIA ABREU VILELA RODRIGUES,15,Não eleito,pi
BARRO DURO,CALINA RAQUEL LOPES BATISTA PEREIRA,13,Não eleito,pi
BARRO DURO,ELOI PEREIRA DE SOUSA,55,Eleito,pi
BATALHA,PATRICIA VASCONCELOS LIMA,13,Não eleito,pi
BATALHA,JOSÉ LUIZ ALVES MACHADO,11,Eleito,pi
BELA VISTA DO PIAUÍ,FRANCISCO DE SOUSA NETO,13,Eleito,pi
BELÉM DO PIAUÍ,JÔNATHAS DE CARVALHO NORONHA,15,Eleito,pi
BENEDITINOS,RAUL PEREIRA BARBOSA,44,Não eleito,pi
BENEDITINOS,FABIO ROBERTO PESSOA DA CUNHA,13,Não eleito,pi
BENEDITINOS,TALLES GUSTAVO MARQUES RODRIGUES,55,Eleito,pi
BERTOLÍNIA,RODRIGO DA ROCHA MARTINS,55,Eleito,pi
BERTOLÍNIA,LUCIANO FONSECA DE SOUSA,13,Não eleito,pi
BETÂNIA DO PIAUÍ,LIDIA ANA COELHO CAVALCANTE,13,Não eleito,pi
BETÂNIA DO PIAUÍ,IJOSEVAN COELHO DAMASCENO,55,Eleito,pi
BOA HORA,FRANCISCO DE CARVALHO COELHO,11,Não eleito,pi
BOA HORA,DOMINGOS COELHO DE RESENDE,13,Eleito,pi
BOA HORA,RAIMUNDO NONATO DA CONCEIÇÃO NASCIMENTO,22,Não eleito,pi
BOCAINA,GUILHERME PORTELA DE DEUS MACÊDO,13,Eleito,pi
BOCAINA,GILBERTO LEAL DE BARROS FILHO,55,Não eleito,pi
BOM JESUS,NESTOR RENATO PINHEIRO ELVAS,15,Eleito,pi
BOM JESUS,MARCOS ANTONIO PARENTE ELVAS COELHO,44,Não eleito,pi
BOM PRINCÍPIO DO PIAUÍ,LUCAS DA SILVA MORAES,15,Não eleito,pi
BOM PRINCÍPIO DO PIAUÍ,FRANCISCO APOLINARIO COSTA MORAES,40,Eleito,pi
BONFIM DO PIAUÍ,AURELIO FERREIRA DOS SANTOS,25,Não eleito,pi
BONFIM DO PIAUÍ,RAIMUNDO FERNANDES LIMA,40,Não eleito,pi
BONFIM DO PIAUÍ,PAULO HENRIQUE RIBEIRO,15,Eleito,pi
BOQUEIRÃO DO PIAUÍ,ANTONIO LUIS SILVA,15,Não eleito,pi
BOQUEIRÃO DO PIAUÍ,GENIR FERREIRA DA SILVA,13,Eleito,pi
BRASILEIRA,RANIERI MAZZILLE RAMOS DE MENESES,10,Eleito,pi
BRASILEIRA,FRANCISCO WILSON AMARAL AGUIAR JUNIOR,13,Não eleito,pi
BREJO DO PIAUÍ,FABIANO FEITOSA LIRA,13,Eleito,pi
BREJO DO PIAUÍ,JOÃO JAIME DA COSTA FILHO,55,Não eleito,pi
BREJO DO PIAUÍ,ROBERT DE MOURA CHAVES,11,Não eleito,pi
BURITI DOS LOPES,LAURA ROSA COLLINS DE OLIVEIRA PORTELA,11,Eleito,pi
BURITI DOS LOPES,JAQUELINE GONCALVES CARVALHO DE BRITO,13,Não eleito,pi
BURITI DOS MONTES,JOSÉ OLAVO MARINHO DE LOIOLA JÚNIOR,15,Eleito,pi
BURITI DOS MONTES,WALDECY SOARES MONTE,55,Não eleito,pi
CABECEIRAS DO PIAUÍ,RAIMUNDO NUNES DA ROCHA JUNIOR,13,Não eleito,pi
CABECEIRAS DO PIAUÍ,ELENITA MACEDO SILVA,10,Não eleito,pi
CABECEIRAS DO PIAUÍ,JOSE DA SILVA FILHO,11,Eleito,pi
CAJAZEIRAS DO PIAUÍ,CARLOS ALBERTO SILVESTRE DE SOUSA,11,Eleito,pi
CAJAZEIRAS DO PIAUÍ,ALDEMAR DA SILVA CARMO NETO,13,Não eleito,pi
CAJUEIRO DA PRAIA,FELIPE DE CARVALHO RIBEIRO,13,Eleito,pi
CAJUEIRO DA PRAIA,GIRVALDO ALBUQUERQUE DA SILVA,77,Não eleito,pi
CAJUEIRO DA PRAIA,TÂNIA MARIA ALBUQUERQUE DA SILVA,18,Não eleito,pi
CAJUEIRO DA PRAIA,ADRIANE RADECKI ZIEGERT,55,Não eleito,pi
CALDEIRÃO GRANDE DO PIAUÍ,DOUGLAS FILIPE SOUSA GONÇALVES,55,Eleito,pi
CAMPINAS DO PIAUÍ,VALDINEI CARVALHO DE MACÊDO,15,Não eleito,pi
CAMPINAS DO PIAUÍ,JOMÁRIO FERREIRA DOS SANTOS,55,Eleito,pi
CAMPO ALEGRE DO FIDALGO,JEAN CARLOS BRAGA RIBEIRO,11,Eleito,pi
CAMPO ALEGRE DO FIDALGO,EDMAR TIAGO TORRES,15,Não eleito,pi
CAMPO GRANDE DO PIAUÍ,FLÁVIO PEREIRA DE SOUSA,10,Não eleito,pi
CAMPO GRANDE DO PIAUÍ,FRANCISCO JOSE BEZERRA,55,Eleito,pi
CAMPO LARGO DO PIAUÍ,MARIA JACI RODRIGUES SANTOS SOUSA,15,Não eleito,pi
CAMPO LARGO DO PIAUÍ,JAIRO SOARES LEITAO,55,Eleito,pi
CAMPO MAIOR,JOÃO FÉLIX DE ANDRADE FILHO,11,Eleito,pi
CAMPO MAIOR,PAULO CEZAR DE SOUSA MARTINS,13,Não eleito,pi
CAMPO MAIOR,JOSÉ RIBAMAR PESSOA,50,Não eleito,pi
CANAVIEIRA,MARIA ISETE PEREIRA DOS SANTOS AMORIM,20,Não eleito,pi
CANAVIEIRA,JOSÉ DONATO DE ARAÚJO NETO,15,Não eleito,pi
CANAVIEIRA,EMILIO JOSÉ RODRIGUES MIRANDA DAMASCENO,55,Não eleito,pi
CANAVIEIRA,ERIKA DE ALBUQUERQUE FONSECA,13,Eleito,pi
CANTO DO BURITI,REGIANE MACHADO SOUZA CHAVES,55,Não eleito,pi
CANTO DO BURITI,GUILHERME MIRANDA E SILVA DE OLIVEIRA,13,Não eleito,pi
CANTO DO BURITI,MARCUS FELLIPE NUNES ALVES,15,Eleito,pi
CAPITÃO DE CAMPOS,MARIA ERONEIDE DOS SANTOS GOMES,15,Eleito,pi
CAPITÃO DE CAMPOS,ALYNE BATISTA IBIAPINA,13,Não eleito,pi
CAPITÃO GERVÁSIO OLIVEIRA,ENIVÁ ARAUJO DE FRANÇA,55,Não eleito,pi
CAPITÃO GERVÁSIO OLIVEIRA,RAIMUNDO COELHO,13,Eleito,pi
CARACOL,FABIANO DIAS DA COSTA,36,Não eleito,pi
CARACOL,RANILETTI CARVALHO DE MACÊDO,13,Eleito,pi
CARAÚBAS DO PIAUÍ,ANDRESSA MARIA LEAL DE SOUSA,13,Eleito,pi
CARAÚBAS DO PIAUÍ,MANOEL PACHECO NETO,55,Não eleito,pi
CARIDADE DO PIAUÍ,CLEIVANILSON JOSÉ DE CARVALHO,55,Eleito,pi
CASTELO DO PIAUÍ,JOSE SOARES DE ABREU JÚNIOR,13,Eleito,pi
CASTELO DO PIAUÍ,OSMANO MOURA DA SILVA,55,Não eleito,pi
CAXINGÓ,WASHINGTON LUIZ BRITO DE SOUSA,55,Não eleito,pi
CAXINGÓ,MAGNUM FERNANDO CARDOSO DOS SANTOS,11,Eleito,pi
COCAL,DOUGLAS DE CARVALHO LIMA,13,Não eleito,pi
COCAL,CRISTIANO FELIPPE DE MELO BRITTO,10,Eleito,pi
COCAL DE TELHA,KARYNE ARAGÃO CANSANÇÃO,55,Eleito,pi
COCAL DOS ALVES,ANTONIO CARDOSO DO AMARAL,55,Não eleito,pi
COCAL DOS ALVES,WODSON GIAN SILVA VIEIRA,13,Eleito,pi
COIVARAS,FRANCISCO DAS CHAGAS OLIVEIRA NETO,15,Não eleito,pi
COIVARAS,JOÃO DA CRUZ MOURÃO,13,Eleito,pi
COLÔNIA DO GURGUÉIA,ALCILENE ALVES DE ARAÚJO,13,Não eleito,pi
COLÔNIA DO GURGUÉIA,SILZO BEZERRA DA SILVA,11,Não eleito,pi
COLÔNIA DO GURGUÉIA,WILON PINHEIRO GUIMARÃES,20,Não eleito,pi
COLÔNIA DO GURGUÉIA,LISIANE FRANCO ROCHA ARAÚJO,15,Eleito,pi
COLÔNIA DO PIAUÍ,SELINDO MAURO CARNEIRO TAPETI SEGUNDO,13,Eleito,pi
COLÔNIA DO PIAUÍ,LÚCIA DE FÁTIMA BARROSO MOURA DE ABREU SÁ,55,Não eleito,pi
CONCEIÇÃO DO CANINDÉ,GLAUCIA RUTH MOREIRA CAMPOS,15,Não eleito,pi
CONCEIÇÃO DO CANINDÉ,DIOGO JANES DE OLIVEIRA,55,Eleito,pi
CORONEL JOSÉ DIAS,VICTOR CESAR DE CARVALHO,55,Eleito,pi
CORONEL JOSÉ DIAS,MANOEL OLIVEIRA GALVÃO,13,Não eleito,pi
CORRENTE,FILEMON JOSÉ FRANCISCO DE SOUZA NOGUEIRA PARANAGUÁ,55,Eleito,pi
CORRENTE,TERTULIANO JOSE CAVALCANTI LUSTOSA,77,Não eleito,pi
CRISTALÂNDIA DO PIAUÍ,SANDALO VAGNER NOGUEIRA,13,Não eleito,pi
CRISTALÂNDIA DO PIAUÍ,MOISÉS DA CUNHA LEMOS FILHO,15,Eleito,pi
CRISTINO CASTRO,FABIO VIEIRA DA SILVA LINS,11,Não eleito,pi
CRISTINO CASTRO,FELIPE FERREIRA DIAS,13,Eleito,pi
CURIMATÁ,JOSÉ AUGUSTO LUSTOSA NETO,11,Não eleito,pi
CURIMATÁ,JOSE ADELMO DA SILVA,15,Eleito,pi
CURRAIS,RAIMUNDO MARTINS DE SOUSA SANTOS SOBRINHO,15,Eleito,pi
CURRAIS,JONNEY BARBOSA FRANCO TORRES,55,Não eleito,pi
CURRAL NOVO DO PIAUÍ,EDGAR FRANCISCO DO NASCIMENTO JUNIOR,15,Eleito,pi
CURRAL NOVO DO PIAUÍ,JOSÉ FRANCISCO DA COSTA FILHO,44,Não eleito,pi
CURRALINHOS,EVERARDO LIMA ARAUJO,13,Eleito,pi
CURRALINHOS,ADSON SILVA PÊGO,55,Não eleito,pi
DEMERVAL LOBÃO,FERNANDO HENRIQUE PEREIRA MELO,15,Não eleito,pi
DEMERVAL LOBÃO,LUIS GONZAGA DE CARVALHO JUNIOR,11,Eleito,pi
DIRCEU ARCOVERDE,FRANCISCO CARLOS DA MOTA,13,Não eleito,pi
DIRCEU ARCOVERDE,WALLACE RAMON CAFÉ E SILVA,15,Eleito,pi
DOM EXPEDITO LOPES,ABIMAEL JOSÉ DO NASCIMENTO LIMA,15,Eleito,pi
DOM EXPEDITO LOPES,ANTONIO GILVÁ RAMOS BARROSO,11,Não eleito,pi
DOM INOCÊNCIO,FERNANDE RIBEIRO DE CASTRO FILHO,55,Eleito,pi
DOM INOCÊNCIO,LUZIVALTER  DIAS DOS SANTOS,15,Não eleito,pi
DOMINGOS MOURÃO,MARIA IRINELDA GOMES DE OLIVEIRA SILVA,13,Eleito,pi
DOMINGOS MOURÃO,DOMINGOS JOSÉ RODRIGUES CAVALEIRO,15,Não eleito,pi
ELESBÃO VELOSO,JOSÉ RONALDO GOMES BARBOSA,11,Eleito,pi
ELESBÃO VELOSO,CLERISTON SILVA MOURA,13,Não eleito,pi
ELISEU MARTINS,ALDIMAR DE SOUSA DIAS,15,Não eleito,pi
ELISEU MARTINS,MARCOS AURÉLIO GUIMARÃES DE ARAUJO,55,Eleito,pi
ESPERANTINA,MÁXIMO JOSÉ DE SAMPAIO MEDEIROS,13,Não eleito,pi
ESPERANTINA,IVANARIA DO NASCIMENTO ALVES SAMPAIO,15,Eleito,pi
FARTURA DO PIAUÍ,ORLANDO COSTA CAMPINHO BRAGA,13,Eleito,pi
FARTURA DO PIAUÍ,ARIEL DAS NEVES BRAGA,44,Não eleito,pi
FLORES DO PIAUÍ,IRIS GUEDES CIPRIANO,55,Não eleito,pi
FLORES DO PIAUÍ,EVANDRO FERREIRA DA COSTA,15,Eleito,pi
FLORESTA DO PIAUÍ,CLAUDIONOR URBANO DE OLIVEIRA,15,Eleito,pi
FLORIANO,CLAUDEMIR REZENDE BARROS,22,Não eleito,pi
FLORIANO,ANTÔNIO REIS NETO,55,Eleito,pi
FLORIANO,MARCUS VINICIUS MALHEIROS KALUME,13,Não eleito,pi
FRANCINÓPOLIS,ANTÔNIO LUIZ DANTAS DA FONSECA,15,Eleito,pi
FRANCINÓPOLIS,MAURO SERGIO MUNIZ DA SILVA,55,Não eleito,pi
FRANCISCO AYRES,EUGÊNIA DE SOUSA NUNES,12,Eleito,pi
FRANCISCO AYRES,VALKIR NUNES DE OLIVEIRA,55,Não eleito,pi
FRANCISCO MACEDO,FRANCISCO DE ASSIS ALENCAR,55,Não eleito,pi
FRANCISCO MACEDO,ADEILSON ANTÃO DE CARVALHO,15,Eleito,pi
FRANCISCO SANTOS,EDILSON MANOEL DA ROCHA,13,Não eleito,pi
FRANCISCO SANTOS,JOSÉ EDSON DE CARVALHO,55,Eleito,pi
FRONTEIRAS,JOSE GENILSON SOBRINHO,13,Não eleito,pi
FRONTEIRAS,EUDES AGRIPINO RIBEIRO,55,Eleito,pi
GEMINIANO,VILMAR DE SÁ CARVALHO,13,Não eleito,pi
GEMINIANO,FRANCISCO JAILLSON DA SILVA CAMPOS,55,Eleito,pi
GILBUÉS,AMILTON LUSTOSA FIGUEREDO FILHO,55,Eleito,pi
GILBUÉS,WILBERTY DA SILVA SILVEIRA,27,Não eleito,pi
GUADALUPE,RANDAL CARVALHO PEREIRA,10,Não eleito,pi
GUADALUPE,JESSE JAMES LIMA MIRANDA,55,Eleito,pi
GUARIBAS,JOÉRCIO MATIAS DE ANDRADE,15,Eleito,pi
GUARIBAS,WANDERSON MARTINS MAIA,77,Não eleito,pi
HUGO NAPOLEÃO,LUCIANO BARRETO DE CARVALHO FILHO,13,Eleito,pi
HUGO NAPOLEÃO,JOAQUIM ALVES DA SILVA,15,Não eleito,pi
HUGO NAPOLEÃO,DANIEL DE CARVALHO SILVA,77,Não eleito,pi
ILHA GRANDE,BERNADETE LEAL DE SOUZA,15,Não eleito,pi
ILHA GRANDE,MARINA DE OLIVEIRA BRITO,11,Eleito,pi
INHUMA,RAFAEL GONÇALVES RODRIGUES MEIRELES,13,Não eleito,pi
INHUMA,ELBERT HOLANDA MOURA,55,Eleito,pi
IPIRANGA DO PIAUÍ,FRANCISCO ELVIS RAMOS VIEIRA,13,Eleito,pi
IPIRANGA DO PIAUÍ,RICARDO DE MOURA LEAL,55,Não eleito,pi
ISAÍAS COELHO,ARISMAGNO CARVALHO MUNIZ,15,Não eleito,pi
ISAÍAS COELHO,WALDEMAR MAURIZ FILHO,12,Eleito,pi
ITAINÓPOLIS,MIGUEL RODRIGUES DE MOURA,12,Eleito,pi
ITAINÓPOLIS,SEBASTIÃO EVANGELISTA DE SOUSA,15,Não eleito,pi
ITAUEIRA,QUIRINO AVELINO NETO,13,Não eleito,pi
ITAUEIRA,OSMUNDO DE MORAES ANDRADE,15,Eleito,pi
JACOBINA DO PIAUÍ,VANDERLEI RAIMUNDO DE CARVALHO,15,Eleito,pi
JAICÓS,MÁVIO SILVEIRA CARVALHO,15,Não eleito,pi
JAICÓS,JOSE WESLLY DE OLIVEIRA BISPO,55,Eleito,pi
JARDIM DO MULATO,AIRTON JOSÉ DA COSTA VELOSO,13,Não eleito,pi
JARDIM DO MULATO,DEJAIR LIMA DE SOUSA,11,Eleito,pi
JATOBÁ DO PIAUÍ,RAIMUNDO NONATO GOMES DE OLIVEIRA,55,Eleito,pi
JATOBÁ DO PIAUÍ,DOGIVAL VIDAL DOS REIS NETO,11,Não eleito,pi
JERUMENHA,JOSÉ INÁCIO PEREIRA DA SILVA JÚNIOR,13,Eleito,pi
JERUMENHA,CHIRLENE DE SOUZA ARAUJO,15,Não eleito,pi
JERUMENHA,FRANCISCO JOSÉ RODRIGUES FILHO,20,Não eleito,pi
JOAQUIM PIRES,DEYVISON GONÇALVES CRUZ,13,Eleito,pi
JOAQUIM PIRES,EDIOS DA SILVA RAMOS,15,Não eleito,pi
JOCA MARQUES,ALDERICO GOMES TAVARES,13,Não eleito,pi
JOCA MARQUES,FABIANNA SPINDOLA MARQUES,15,Eleito,pi
JOSÉ DE FREITAS,RICARDO SILVA CAMARÇO,10,Não eleito,pi
JOSÉ DE FREITAS,FERDINAND CARVALHO DE ALMENDRA FREITAS NETO,15,Não eleito,pi
JOSÉ DE FREITAS,PEDRO GOMES DOS SANTOS FILHO,13,Eleito,pi
JOÃO COSTA,JOSÉ NETO DE OLIVEIRA,40,Não eleito,pi
JOÃO COSTA,GILSON CASTRO DE ASSIS,55,Eleito,pi
JUAZEIRO DO PIAUÍ,JOSE WILSON PEREIRA GOMES,15,Eleito,pi
JUAZEIRO DO PIAUÍ,ERONILSA PEREIRA DE SOUSA,55,Não eleito,pi
JUREMA,KAYLANNE DA SILVA OLIVEIRA,15,Eleito,pi
JUREMA,LUCRÉCIA MARIA FIGUEIREDO DA SILVA,13,Não eleito,pi
JÚLIO BORGES,LUZIENE FRANCISCO DA SILVA,13,Não eleito,pi
JÚLIO BORGES,JOÃO PAULO PEREIRA E SILVA,11,Eleito,pi
JÚLIO BORGES,MARCO LEANDRO CASTRO DE CARVALHO,77,Não eleito,pi
LAGOA ALEGRE,FRANCISCO WAGNER SAMPAIO BARROS,15,Não eleito,pi
LAGOA ALEGRE,OSAEL MOITA LEAL,12,Eleito,pi
LAGOA DE SÃO FRANCISCO,JOÃO ARILSON DE MESQUITA BEZERRA,13,Eleito,pi
LAGOA DE SÃO FRANCISCO,JOSE PIO MENDES DE MESQUITA,55,Não eleito,pi
LAGOA DO BARRO DO PIAUÍ,DARCY RIBEIRO COELHO,13,Não eleito,pi
LAGOA DO BARRO DO PIAUÍ,REGINALDO APARECIDO COSTA COELHO,15,Eleito,pi
LAGOA DO PIAUÍ,CAMILA BARBOSA SOUSA OLIVEIRA,13,Eleito,pi
LAGOA DO PIAUÍ,ANTÔNIO FRANCISCO DE OLIVEIRA NETO,11,Não eleito,pi
LAGOA DO SÍTIO,JOSE SAVIO DE MOURA E SILVA,11,Eleito,pi
LAGOA DO SÍTIO,VANESSA HELENA AMORIM NEVES REIS,13,Não eleito,pi
LAGOINHA DO PIAUÍ,KELLY ALVES ALENCAR,15,Eleito,pi
LAGOINHA DO PIAUÍ,ERISVALDO LIMA DA COSTA,55,Não eleito,pi
LANDRI SALES,DELISMON SOARES PEREIRA,15,Eleito,pi
LANDRI SALES,ADRIANA SARAIVA DE SÁ,13,Não eleito,pi
LUIS CORREIA,RAPHAEL DOS SANTOS SILVA,55,Não eleito,pi
LUIS CORREIA,MARIA DAS DORES FONTENELE BRITO,13,Eleito,pi
LUZILÂNDIA,FERNANDA PINTO MARQUES,13,Eleito,pi
LUZILÂNDIA,ACELINO DE BARROS GALVAO JUNIOR,15,Não eleito,pi
MADEIRO,ALANDELON ARAUJO DOS SANTOS,55,Eleito,pi
MADEIRO,PEDRO TEIXEIRA JÚNIOR,15,Não eleito,pi
MANOEL EMÍDIO,CLAUDIA MARIA DE JESUS PIRES MEDEIROS,15,Não eleito,pi
MANOEL EMÍDIO,ORLANDO ALMEIDA DE ARAUJO,55,Eleito,pi
MARCOLÂNDIA,CORINTO MACHADO DE MATOS NETO,15,Eleito,pi
MARCOLÂNDIA,FRANCISCO PEDRO DE ARAUJO,13,Não eleito,pi
MARCOS PARENTE,GEDISON ALVES RODRIGUES,55,Eleito,pi
MARCOS PARENTE,RICARDO MARTINS PINHEIRO,13,Não eleito,pi
MASSAPÊ DO PIAUÍ,RIVALDO DE CARVALHO COSTA,55,Não eleito,pi
MASSAPÊ DO PIAUÍ,WILTON COUTINHO SILVA,15,Eleito,pi
MATIAS OLÍMPIO,ANTONIO DE SOUSA BORGES,20,Não eleito,pi
MATIAS OLÍMPIO,FRANKLIN DA SILVA LIMA,13,Não eleito,pi
MATIAS OLÍMPIO,GENIVALDO NASCIMENTO ALMEIDA,15,Eleito,pi
MIGUEL ALVES,FRANCISCO ANTONIO REBELO DE PAIVA,15,Eleito,pi
MIGUEL ALVES,MIGUEL BORGES DE OLIVEIRA NETO,13,Não eleito,pi
MIGUEL LEÃO,NEUZA CUNHA DE ARAÚJO,11,Eleito,pi
MIGUEL LEÃO,WALTER RIBEIRO ALENCAR,55,Não eleito,pi
MILTON BRANDÃO,FRANCISCO EVANGELISTA RESENDE,15,Eleito,pi
MILTON BRANDÃO,FRANCISCO RAÍ DE SOUSA SILVA,13,Não eleito,pi
MONSENHOR GIL,JOAO DA CRUZ COSTA SILVA,10,Não eleito,pi
MONSENHOR GIL,EVANDRO LEAL DE ABREU,55,Eleito,pi
MONSENHOR GIL,ELIANE DA SILVA MOURA,13,Não eleito,pi
MONSENHOR HIPÓLITO,ZENON DE MOURA BEZERRA,55,Não eleito,pi
MONSENHOR HIPÓLITO,ANTONIO DJALMA BEZERRA POLICARPO,11,Eleito,pi
MONTE ALEGRE DO PIAUÍ,DAVINELSON SOARES ROSAL,15,Não eleito,pi
MONTE ALEGRE DO PIAUÍ,DIJALMA GOMES MASCARENHAS,55,Eleito,pi
MORRO CABEÇA NO TEMPO,RAMON PAULO ALVES DA SILVA,12,Não eleito,pi
MORRO CABEÇA NO TEMPO,JOSUÉ ALVES DA SILVA,11,Eleito,pi
MORRO DO CHAPÉU DO PIAUÍ,JOÃO PAULO DE ARAÚJO VIANA,13,Não eleito,pi
MORRO DO CHAPÉU DO PIAUÍ,ERIKSON FENELON AGUIAR,55,Eleito,pi
MURICI DOS PORTELAS,ANA LINA DE CARVALHO CUNHA SALES,55,Eleito,pi
MURICI DOS PORTELAS,FRANCISCO DAS CHAGAS DE SOUSA,25,Não eleito,pi
NAZARÉ DO PIAUÍ,LUCIELIO GOMES DE SOUSA,15,Não eleito,pi
NAZARÉ DO PIAUÍ,RONIELTON COSTA DE OLIVEIRA,55,Eleito,pi
NAZÁRIA,LUIZ CARLOS DA SILVA,55,Não eleito,pi
NAZÁRIA,JOAQUIM NONATO DA SILVA FILHO,15,Eleito,pi
NAZÁRIA,CREANE DE SOUSA DA SILVA ARAUJO,20,Não eleito,pi
NOSSA SENHORA DE NAZARÉ,LUCAS COSTA DE OLIVEIRA,12,Não eleito,pi
NOSSA SENHORA DE NAZARÉ,JOSÉ HENRIQUE DE OLIVEIRA ALVES,55,Eleito,pi
NOSSA SENHORA DOS REMÉDIOS,RONALDO CÉSAR LAGES CASTELO BRANCO FILHO,13,Não eleito,pi
NOSSA SENHORA DOS REMÉDIOS,JOSÉ FERNANDO OLIVEIRA DE BRITO,55,Eleito,pi
NOVA SANTA RITA,HELI MARQUES DE CARVALHO,11,Eleito,pi
NOVA SANTA RITA,ANTONIO FRANCISCO RODRIGUES DA SILVA,15,Não eleito,pi
NOVO ORIENTE DO PIAUÍ,FRANCISCO AFONSO RIBEIRO SOBREIRA,11,Eleito,pi
NOVO ORIENTE DO PIAUÍ,MARCOS VINICIUS CUNHA DIAS,20,Não eleito,pi
NOVO SANTO ANTÔNIO,ELISA MARIA DA SILVA PAZ,13,Eleito,pi
NOVO SANTO ANTÔNIO,LUCIVALDO ALVES CABRAL,15,Não eleito,pi
OEIRAS,HAILTON ALVES FILHO,77,Eleito,pi
OEIRAS,JOSÉ ALBERTO PINHEIRO DE ARAUJO,55,Não eleito,pi
OLHO D&apos;ÁGUA DO PIAUÍ,ANTONIO LEAL DA SILVA,11,Eleito,pi
OLHO D&apos;ÁGUA DO PIAUÍ,GERALDO AMANCIO GUEDES JUNIOR,13,Não eleito,pi
PADRE MARCOS,GERALDO DIVINO DOS REIS,15,Não eleito,pi
PADRE MARCOS,WILIANE KELLY DA SILVA,55,Eleito,pi
PAES LANDIM,THALLES MOURA FÉ MARQUES,15,Não eleito,pi
PAES LANDIM,FRANCINALDO MORAES BEZERRA,13,Eleito,pi
PAJEÚ DO PIAUÍ,DALVAN GONÇALVES DE MOURA CARVALHO,15,Eleito,pi
PAJEÚ DO PIAUÍ,ALESSANDRO PEREIRA DA SILVA,55,Não eleito,pi
PALMEIRA DO PIAUÍ,HUGUEMAR ROSAL LUSTOSA FILHO,77,Eleito,pi
PALMEIRA DO PIAUÍ,ROBERTO DIAS LEAL,55,Não eleito,pi
PALMEIRAIS,GABRIEL NUNES DE SOUSA,11,Não eleito,pi
PALMEIRAIS,NATALIA DE SENA MONTEIRO LIMA PINHEIRO,13,Não eleito,pi
PALMEIRAIS,JOSÉ BALTAZAR DE OLIVEIRA,77,Eleito,pi
PAQUETÁ,ADERINALDO GALDINO DOS SANTOS,13,Não eleito,pi
PAQUETÁ,ANDERSON CLAYTON DA SILVA BARROS,11,Eleito,pi
PARNAGUÁ,MARCOS MILTON SOARES LUSTOSA DE ARAUJO,13,Não eleito,pi
PARNAGUÁ,PEDRO GUIDA NETO,77,Não eleito,pi
PARNAGUÁ,MIGUEL OMAR BARRETO RISSI,11,Eleito,pi
PARNAÍBA,FRANCISCO EMANUEL CUNHA DE BRITO,11,Eleito,pi
PARNAÍBA,JOSE HAMILTON FURTADO CASTELLO BRANCO,55,Não eleito,pi
PARNAÍBA,ERIVELTON FONTENELE,27,Não eleito,pi
PARNAÍBA,JOSÉ HÉLIO DE CARVALHO OLIVEIRA,15,Não eleito,pi
PASSAGEM FRANCA DO PIAUÍ,FREDE FARIAS DOS SANTOS,15,Não eleito,pi
PASSAGEM FRANCA DO PIAUÍ,SAULO VINICIUS RODRIGUES SATURNINO,13,Eleito,pi
PATOS DO PIAUÍ,JOAQUIM LOPES DOS REIS NETO,55,Eleito,pi
PATOS DO PIAUÍ,JOSE IRANILDO MARQUES SANTANA,13,Não eleito,pi
PAU D&apos;ARCO DO PIAUÍ,BRUNO MARQUES SARAIVA PAIVA,15,Não eleito,pi
PAU D&apos;ARCO DO PIAUÍ,ANTONIO MILTON DE ABREU PASSOS,13,Eleito,pi
PAULISTANA,JOÃO BATISTA RIBEIRO,12,Não eleito,pi
PAULISTANA,JOAQUIM JULIO COELHO,55,Não eleito,pi
PAULISTANA,OSVALDO MAMEDIO DA COSTA,15,Eleito,pi
PAVUSSU,FABIO ALVES GOMES,13,Não eleito,pi
PAVUSSU,WININCIUS VILANOVA DE MIRANDA,55,Eleito,pi
PEDRO II,NEUMA MARIA CAFÉ BARROSO,13,Não eleito,pi
PEDRO II,ELISABETE RODRIGUES DE OLIVEIRA NUNES BRANDÃO,15,Eleito,pi
PEDRO LAURENTINO,GILSON EUGENIO RODRIGUES,13,Não eleito,pi
PEDRO LAURENTINO,CARLOS HENRIQUE COELHO REIS,15,Eleito,pi
PICOS,PABLO DANTAS DE MOURA SANTOS,15,Eleito,pi
PICOS,GIL MARQUES DE MEDEIROS,11,Não eleito,pi
PICOS,LUIZ FRANCISCO ARAÚJO DO REGO MELLO,23,Não eleito,pi
PIMENTEIRAS,ANTONIO FEITOSA SOUSA,13,Não eleito,pi
PIMENTEIRAS,MARIA LUCIA DE LACERDA,55,Eleito,pi
PIO IX,FANUEL ADAUTO DE ALENCAR ANDRADE,13,Não eleito,pi
PIO IX,SILAS NORONHA MOTA,55,Eleito,pi
PIRACURUCA,FRANCISCO DE ASSIS DA SILVA MELO,13,Não eleito,pi
PIRACURUCA,FRANCISCO MARCELO CARVALHO MENDES,55,Eleito,pi
PIRIPIRI,PAULO ROBERTO LIMEIRA DOS SANTOS,70,Não eleito,pi
PIRIPIRI,JOVENILIA ALVES DE OLIVEIRA MONTEIRO,13,Eleito,pi
PIRIPIRI,LUIZ CAVALCANTE E MENEZES,55,Não eleito,pi
PORTO,ANTONIO COSTA OLIVEIRA,20,Não eleito,pi
PORTO,ANTONIO RODRIGUES GERONÇO,55,Não eleito,pi
PORTO,ALUIZIO MOREIRA VAZ,13,Eleito,pi
PORTO ALEGRE DO PIAUÍ,ANTÔNIO AVELINO ROCHA DE NEIVA,11,Eleito,pi
PORTO ALEGRE DO PIAUÍ,JOÃO CARLOS ALVES DOS SANTOS SILVA,13,Não eleito,pi
PRATA DO PIAUÍ,ANA KAROLINA MARQUES DE CARVALHO,13,Não eleito,pi
PRATA DO PIAUÍ,ANTONIO SEVERINO DUARTE NETO,45,Não eleito,pi
PRATA DO PIAUÍ,MANOEL JOSE ALVES DA SILVA,50,Não eleito,pi
PRATA DO PIAUÍ,ACELINO MENDES DE MOURA,55,Eleito,pi
QUEIMADA NOVA,GILMAR MACEDO DE ANDRADE,55,Eleito,pi
QUEIMADA NOVA,ADILSON MANOEL COELHO,12,Não eleito,pi
QUEIMADA NOVA,CELSO NUNES AMORIM,15,Não eleito,pi
REDENÇÃO DO GURGUÉIA,ARLEI FIGUEIREDO BORGES,15,Eleito,pi
REDENÇÃO DO GURGUÉIA,NILDA DE SOUSA SOARES,55,Não eleito,pi
REGENERAÇÃO,MARILIA GABRIELA MENDES DO CHANTAL NUNES,10,Não eleito,pi
REGENERAÇÃO,EDUARDO ALVES CARVALHO,55,Eleito,pi
RIACHO FRIO,JABES LUSTOSA NOGUEIRA JUNIOR,55,Eleito,pi
RIBEIRA DO PIAUÍ,ANTÔNIO LUIZ DE ARAÚJO COSTA NETO,13,Eleito,pi
RIBEIRA DO PIAUÍ,LUIZ VIEIRA DE SOUSA,11,Não eleito,pi
RIBEIRO GONÇALVES,AGAMENON PINHEIRO FRANCO,13,Eleito,pi
RIBEIRO GONÇALVES,EDUARDO SOARES RIBEIRO,10,Não eleito,pi
RIO GRANDE DO PIAUÍ,ANTONIO LUIS DA COSTA FEITOSA,55,Eleito,pi
RIO GRANDE DO PIAUÍ,LEONISIO SILVA FEITOSA,13,Não eleito,pi
SANTA CRUZ DO PIAUÍ,UBIRATAN MARTINS DOS SANTOS,12,Não eleito,pi
SANTA CRUZ DO PIAUÍ,LAÍS BARROSO MARTINS DOS SANTOS NUNES,13,Eleito,pi
SANTA CRUZ DOS MILAGRES,EDILBERTO MENDES GUIMARAES,11,Eleito,pi
SANTA CRUZ DOS MILAGRES,ANTONIO TOME SOARES DE CARVALHO NETO,13,Não eleito,pi
