municipio,nome,numero,situacao,estado
MONTES CLAROS,RUY ADRIANO BORGES MUNIZ,40,Não eleito,mg
MONTES CLAROS,MAURICIO SERGIO SOUSA E SILVA,22,Não eleito,mg
MONTEZUMA,ERIVAL JOSE MARTINS,45,Não eleito,mg
MONTEZUMA,IVAN VIEIRA DE PINHO,44,Eleito,mg
MORADA NOVA DE MINAS,FLAVIO GERALDO VARGAS DE SOUZA SANTOS,13,Não eleito,mg
MORADA NOVA DE MINAS,OLIMPIO DE MOURA DAYRELL,15,Não eleito,mg
MORADA NOVA DE MINAS,HERMANO ALVARES FRANCISCO DE MOURA,45,Eleito,mg
MORRO DA GARÇA,MÁRCIO TÚLIO LEITE ROCHA,55,Eleito,mg
MORRO DA GARÇA,JOSÉ MARIA DE CASTRO MATOS,13,Não eleito,mg
MORRO DO PILAR,CLERIO LIMA FILHO,55,Eleito,mg
MORRO DO PILAR,MARIA EDUARDA DE MATOS VIEIRA,12,Não eleito,mg
MUNHOZ,DORIVAL AMANCIO FROES,44,Eleito,mg
MUNHOZ,EVANICE VIEIRA SILVA,10,Não eleito,mg
MUNHOZ,JURANDIR DA ROSA,11,Não eleito,mg
MURIAÉ,LEONARDO PACHECO ROCHA,30,Não eleito,mg
MURIAÉ,MARCOS GUARINO DE OLIVEIRA,40,Eleito,mg
MURIAÉ,VALDINEI LACERDA DA SILVA,20,Não eleito,mg
MUTUM,FABIANO GOMES DOS REIS,22,Não eleito,mg
MUTUM,JOAO BATISTA MARCAL TEIXEIRA,13,Não eleito,mg
MUTUM,CLAUDINEI CLEMENTE DE FREITAS,10,Eleito,mg
MUZAMBINHO,LISANDRO CARVALHO DE ALMEIDA LIMA,13,Não eleito,mg
MUZAMBINHO,SERGIO ARLINDO CERAVOLO PAOLIELLO,22,Não eleito,mg
MUZAMBINHO,MURILO BUENO GONÇALVES,55,Não eleito,mg
MUZAMBINHO,PAULO SERGIO MAGALHÃES,11,Eleito,mg
MÁRIO CAMPOS,DOUGLAS JUNIOR CAMPOS,30,Não eleito,mg
MÁRIO CAMPOS,ANDRESA APARECIDA ROCHA RODRIGUES,40,Eleito,mg
NACIP RAYDAN,GEREMIAS CANDIDO DE SOUSA,11,Eleito,mg
NACIP RAYDAN,ARTHUR OLIVEIRA SILVA,40,Não eleito,mg
NANUQUE,NAIARA LIMA SOUZA,45,Não eleito,mg
NANUQUE,ROBERTO DE JESUS,70,Não eleito,mg
NANUQUE,GILSON COLETA BARBOSA,11,Eleito,mg
NANUQUE,ELEONAI DE SOUZA COSTA,13,Não eleito,mg
NAQUE,ROBSON DE SENA MOREIRA,12,Eleito,mg
NAQUE,GERALDO MARTINS GODOY,15,Não eleito,mg
NATALÂNDIA,PAULO SERGIO LAURINDO MODESTO,43,Eleito,mg
NATALÂNDIA,UADIR PEDRO MARTINS DE MELO,55,Não eleito,mg
NATÉRCIA,GABRIEL TIAGO DE VILAS BOAS,55,Eleito,mg
NAZARENO,DIEGO FREITAS ALVARENGA,25,Eleito,mg
NAZARENO,LUIZ ANTONIO CARVALHO DOS SANTOS,55,Não eleito,mg
NAZARENO,LÚCIO ANTÔNIO DA SILVA,70,Não eleito,mg
NEPOMUCENO,FRANCISCO RICARDO GATTINI,10,Não eleito,mg
NEPOMUCENO,ELIAS NATAL LIMA DE MENEZES,45,Eleito,mg
NEPOMUCENO,LUIZ FERNANDO PEREIRA SOUZA,43,Não eleito,mg
NINHEIRA,WAGNER ANTUNES SPOSITO,15,Não eleito,mg
NINHEIRA,NODECIR PEREIRA,55,Eleito,mg
NOVA BELÉM,VALDECI DORNELAS,55,Eleito,mg
NOVA BELÉM,ELI DOS REIS,44,Não eleito,mg
NOVA ERA,TXAI SILVA COSTA,18,Eleito,mg
NOVA LIMA,GILSON CLÁUDIO AMORIM,10,Não eleito,mg
NOVA LIMA,JOÃO MARCELO DIEGUEZ PEREIRA,23,Eleito,mg
NOVA LIMA,CRISTIANE PAULA MARQUES DE CARVALHO NUNES,50,Não eleito,mg
NOVA LIMA,MAURI LOPES FERREIRA,13,Não eleito,mg
NOVA MÓDICA,RAPHAEL SOUSA MARTINS,15,Eleito,mg
NOVA MÓDICA,JACQUELINE RUBIA GIL BASTOS RAMOS,70,Não eleito,mg
NOVA PONTE,JOSÉ DIVINO DA SILVA,11,Eleito,mg
NOVA PONTE,LIVIA MARIA AMBROSIO DA SILVA,23,Não eleito,mg
NOVA PORTEIRINHA,REGINA ANTONIA DE SOUZA FREITAS,44,Não eleito,mg
NOVA PORTEIRINHA,ELBE FIGUEIREDO BRANDÃO,23,Eleito,mg
NOVA PORTEIRINHA,SOLANGE BATISTA DE ALMEIDA OLIVEIRA,55,Não eleito,mg
NOVA PORTEIRINHA,JOELIA SANTOS BARBOSA,13,Não eleito,mg
NOVA RESENDE,LUIZ ITAMAR GONZAGA,22,Eleito,mg
NOVA RESENDE,DARLON ALVES MADEIRA,44,Não eleito,mg
NOVA RESENDE,RONEI VITOR DE BRITO,13,Não eleito,mg
NOVA SERRANA,FABIO JOSE DE OLIVEIRA,70,Eleito,mg
NOVA SERRANA,FABIO RUBENS BORGES DE MATOS,13,Não eleito,mg
NOVA SERRANA,ENEAS FERNANDES ROSA,22,Não eleito,mg
NOVA UNIÃO,WALDIR JOSE DOS SANTOS,55,Eleito,mg
NOVA UNIÃO,NILZA SILVÉRIA DE CARVALHO MEIRELES,22,Não eleito,mg
NOVA UNIÃO,MOACIR BARBOSA DE FIGUEIREDO,18,Não eleito,mg
NOVO CRUZEIRO,GUSTAVO LUIS BRANDÃO DE OLIVEIRA,11,Não eleito,mg
NOVO CRUZEIRO,VIVIANE BARBOSA PENA,55,Eleito,mg
NOVO ORIENTE DE MINAS,NORMANDES DA COSTA JARDIM,10,Eleito,mg
NOVO ORIENTE DE MINAS,FABIO RODRIGUES GONÇALVES,15,Não eleito,mg
NOVO ORIENTE DE MINAS,PAULO RENATO MEDEIROS DE CARVALHO,13,Não eleito,mg
NOVO ORIENTE DE MINAS,JEIDER SILVA RAMALHO,70,Não eleito,mg
NOVORIZONTE,JORGE LUIZ BATISTA NEVES,11,Não eleito,mg
NOVORIZONTE,CLEBER NASCIMENTO DE PINHO,55,Eleito,mg
OLARIA,NELSON MOREIRA DE PAULA,40,Não eleito,mg
OLARIA,WALDINEY DOS REIS FERREIRA,70,Eleito,mg
OLHOS D&apos;ÁGUA,RODRIGO VIEIRA DE MATOS,10,Eleito,mg
OLHOS D&apos;ÁGUA,JOSE FONSECA COELHO,15,Não eleito,mg
OLIVEIRA,NALTON SEBASTIAO MOREIRA DA CRUZ,18,Não eleito,mg
OLIVEIRA,ERIK ASSIS CASTRO,77,Eleito,mg
OLIVEIRA,LEONARDO ANANIAS LEÃO,70,Não eleito,mg
OLIVEIRA,JOAO BATISTA RIBEIRO,11,Não eleito,mg
OLIVEIRA FORTES,FABRICIO JOSE CAMPOS DA SILVEIRA,55,Não eleito,mg
OLIVEIRA FORTES,SILMAR JOSE DIAS,44,Eleito,mg
OLÍMPIO NORONHA,WELINGTON ROCHA DE OLIVEIRA,40,Não eleito,mg
OLÍMPIO NORONHA,CARLOS ALBERTO DE CASTRO  PEREIRA,11,Eleito,mg
OLÍMPIO NORONHA,EDSON FRANCISDO DA SILVA,12,Não eleito,mg
ONÇA DE PITANGUI,JOÃO BATISTA BRAGA DE FREITAS,22,Não eleito,mg
ONÇA DE PITANGUI,GUMERCINDO PEREIRA,15,Eleito,mg
ONÇA DE PITANGUI,GERALDO MAGELA BARBOSA,70,Não eleito,mg
ORATÓRIOS,ODILON FERREIRA DE OLIVEIRA JÚNIOR,45,Não eleito,mg
ORATÓRIOS,CARLOS JOSE DE OLIVEIRA,40,Eleito,mg
ORIZÂNIA,JONIA LEITE FILHO,12,Eleito,mg
ORIZÂNIA,GILMAR ANTONIO FIALHO,10,Não eleito,mg
OURO BRANCO,LEANDRO MARCELO SOUZA,45,Não eleito,mg
OURO BRANCO,JOSE VICENTE SANTIAGO,15,Não eleito,mg
OURO BRANCO,PÉRICLES D&apos;AVILA BARTHOLOMEU,22,Não eleito,mg
OURO BRANCO,GILBERTO RIBEIRO EGGE,13,Não eleito,mg
OURO BRANCO,SAVIO RODRIGUES FONTES,10,Eleito,mg
OURO FINO,ANTÔNIO BENEDITO SALGUEIRO MIGUEL,30,Eleito,mg
OURO FINO,BRUNO ZUCARELI,44,Não eleito,mg
OURO PRETO,ANGELO OSWALDO DE ARAUJO SANTOS,43,Eleito,mg
OURO PRETO,DUARTE EUSTÁQUIO GONÇALVES JÚNIOR,10,Não eleito,mg
OURO PRETO,EDUARDO EVANGELISTA FERREIRA,50,Não eleito,mg
OURO PRETO,ELISMAR RAIMUNDO DE SOUZA,22,Não eleito,mg
OURO VERDE DE MINAS,MARCELO ADRIANO XAVIER DE VASCONCELOS,33,Eleito,mg
OURO VERDE DE MINAS,EDERNANDES FERREIRA SILVA,22,Não eleito,mg
OURO VERDE DE MINAS,ALINY GONÇALVES BATISTA,55,Não eleito,mg
PADRE CARVALHO,ELCIO PEREIRA DE OLIVEIRA,11,Não eleito,mg
PADRE CARVALHO,SAMIA FERES GOMES DE MEDEIROS,22,Eleito,mg
PADRE CARVALHO,OSMANDO JOSÉ DOS SANTOS,55,Não eleito,mg
PADRE PARAÍSO,JOSE CARLOS DE JESUS QUEIROZ,44,Não eleito,mg
PADRE PARAÍSO,WENDERSON DE ALMEIDA PEDROSO,12,Não eleito,mg
PADRE PARAÍSO,DIEGO FERDINANDO MENDES OLIVEIRA,77,Eleito,mg
PAI PEDRO,JOAQUIM RODRIGUES JÚNIOR,11,Eleito,mg
PAI PEDRO,FERNANDO COSTA DA SILVA,55,Não eleito,mg
PAINEIRAS,OSMAN DE CASTRO MENEZES,70,Eleito,mg
PAINEIRAS,MARCOS WELINGTON DE LIMA,13,Não eleito,mg
PAINEIRAS,GERALDO MAGELA MENDES DA FONSECA,15,Não eleito,mg
PAINS,AGUILAR RODRIGUES DE FARIA JUNIOR,11,Não eleito,mg
PAINS,ITAMAR RAFAEL DE CASTRO,44,Eleito,mg
PAIVA,SEBASTIÃO PEDRO NEPOMUCENO,12,Não eleito,mg
PAIVA,BRUNO VIEIRA DE PAULA,20,Eleito,mg
PALMA,JOSIMAR DA SILVA RODRIGUES,20,Eleito,mg
PALMA,LUIZ ANTONIO DE FREITAS,11,Não eleito,mg
PALMÓPOLIS,LEANDRO PINTO ROCHA,55,Eleito,mg
PALMÓPOLIS,EDMILSON PEREIRA AGUIAR,10,Não eleito,mg
PAPAGAIOS,RISLAINE DE FARIA CANÇADO,70,Eleito,mg
PARACATU,IGOR PEREIRA DOS SANTOS,44,Eleito,mg
PARACATU,FAGNER JOAQUIM DE ANDRADE,40,Não eleito,mg
PARACATU,OLAVO REMIGIO CONDÉ,45,Não eleito,mg
PARAGUAÇU,ANDRÉ ROMÃO NASSER,44,Não eleito,mg
PARAGUAÇU,GABRIEL PEREIRA DE MORAES FILHO,12,Eleito,mg
PARAISÓPOLIS,EVERTON DE ASSIS FERREIRA,10,Eleito,mg
PARAISÓPOLIS,ALFREDO FARIA LOPES DE PAIVA,13,Não eleito,mg
PARAISÓPOLIS,ANDERSON VITORIO RIBEIRO DOS SANTOS,55,Não eleito,mg
PARAISÓPOLIS,ISABEL CRISTINA DE LIMA,44,Não eleito,mg
PARAOPEBA,MAURO CESAR DE LIMA,12,Não eleito,mg
PARAOPEBA,AROLDO COSTA MELO,22,Eleito,mg
PARAOPEBA,LUCIDIO IUSTAQUIO PIO,10,Não eleito,mg
PARAOPEBA,FLAVIO AUGUSTO EDMUNDO OLIVEIRA,13,Não eleito,mg
PARÁ DE MINAS,INÁCIO FRANCO,22,Eleito,mg
PARÁ DE MINAS,ANDREIA XAVIER PAULINO DE OLIVEIRA,55,Não eleito,mg
PARÁ DE MINAS,JOSÉ CORNÉLIO DE OLIVEIRA,25,Não eleito,mg
PARÁ DE MINAS,DANIEL KENNEDY MOREIRA,33,Não eleito,mg
PARÁ DE MINAS,ANA PAULA COUTO GOMES,30,Não eleito,mg
PARÁ DE MINAS,ANTONIO CARLOS VIEIRA,13,Não eleito,mg
PASSA QUATRO,MARCELO DA SILVA GUEDES,15,Não eleito,mg
PASSA QUATRO,CREMILDA MURUBIXABA,12,Não eleito,mg
PASSA QUATRO,MARCIO HENRIQUE DE SIQUEIRA RIBEIRO,77,Eleito,mg
PASSA TEMPO,LILIAN BEATRICE RESENDE FALEIRO URBANO,11,Não eleito,mg
PASSA TEMPO,JUSCELINO ROCHA,10,Eleito,mg
PASSA VINTE,SIMONE ALINE ABRANCHES MACHADO,45,Não eleito,mg
PASSA VINTE,EDSON DO NASCIMENTO,25,Eleito,mg
PASSA VINTE,HAIKA ISMINIKER ALMEIDA KIRCHMAIR,70,Não eleito,mg
PASSA VINTE,BRAULIO FONSECA RODRIGUES,11,Não eleito,mg
PASSABÉM,LUCIANO DE SÁ MADUREIRA,33,Eleito,mg
PASSABÉM,KLÉBER BATISTA MEIRELES,10,Não eleito,mg
PASSOS,DIEGO RODRIGO DE OLIVEIRA,55,Eleito,mg
PASSOS,SIMONE CRISTINA SILVA FERREIRA,22,Não eleito,mg
PASSOS,RODNEY MALVEIRA DA SILVA,13,Não eleito,mg
PATIS,JAKSON LOPES MAIA,20,Não eleito,mg
PATIS,ELIVALDO VERSIANI SOUZA,44,Eleito,mg
PATOS DE MINAS,LUÍS EDUARDO FALCÃO FERREIRA,30,Eleito,mg
PATOS DE MINAS,RILDO RODRIGUES DO CARMO,18,Não eleito,mg
PATOS DE MINAS,DOLGLAS EDUARDO SILVA,44,Não eleito,mg
PATROCÍNIO,WELLINGTON RODRIGO FERNANDES,15,Não eleito,mg
PATROCÍNIO,GUSTAVO TAMBELINI BRASILEIRO,27,Eleito,mg
PATROCÍNIO,BIANCA SOARES DE OLIVEIRA GONÇALVES,13,Não eleito,mg
PATROCÍNIO DO MURIAÉ,GOLDSTEIN AGOSTINI DA MATTA,45,Eleito,mg
PATROCÍNIO DO MURIAÉ,PABLO EMILIO CAMPOS CORREA,44,Não eleito,mg
PAULA CÂNDIDO,CLEVERSON DA SILVA PIRES,33,Não eleito,mg
PAULA CÂNDIDO,DOUGLAS MATIAS DE OLIVEIRA,27,Não eleito,mg
PAULA CÂNDIDO,DANIEL GOMES CALIXTO,25,Não eleito,mg
PAULA CÂNDIDO,EVERALDO ROBERTO DA CONCEIÇÃO,44,Eleito,mg
PAULISTAS,LUCAS CARMO DOS SANTOS,12,Não eleito,mg
PAULISTAS,ARNALDO SOARES PASCOAL,70,Eleito,mg
PAULISTAS,EDUARDO GONÇALVES DE MORAIS,55,Não eleito,mg
PAULISTAS,JOAQUIM RICARDO FILHO,13,Não eleito,mg
PAVÃO,JANE CARLA PEREIRA DA ROCHA,13,Eleito,mg
PAVÃO,LUCIANO BALARINI GONÇALVES,44,Não eleito,mg
PEDRA AZUL,MARCIO FERREIRA SOUTO,10,Eleito,mg
PEDRA AZUL,SILVANA MARIA ARAUJO MENDES,77,Não eleito,mg
PEDRA BONITA,CLEVERSON JOSÉ PEREIRA,44,Não eleito,mg
PEDRA BONITA,PEDRO RUBENS VITOR DE OLIVEIRA,22,Eleito,mg
PEDRA DO ANTA,ROBSON JOSÉ ANTONUCI PEREIRA,55,Não eleito,mg
PEDRA DO ANTA,EDUARDO JOSE VIANA,22,Eleito,mg
PEDRA DO INDAIÁ,ITAMAR JOSE DA COSTA,22,Não eleito,mg
PEDRA DO INDAIÁ,MATEUS MARCIANO DOS SANTOS,55,Eleito,mg
PEDRA DOURADA,VANDIR PEDROSA DE MENDONÇA,33,Não eleito,mg
PEDRA DOURADA,JOÃO BATISTA CRUZ,13,Não eleito,mg
PEDRA DOURADA,CLAYTON MORAES FREITAS,11,Não eleito,mg
PEDRA DOURADA,SILVANIR SIMPLÍCIO DE ANDRADE,55,Não eleito,mg
PEDRA DOURADA,FAGNER FERREIRA VEIGA,44,Eleito,mg
PEDRALVA,JOÃO ALBERTO SILVA,55,Não eleito,mg
PEDRALVA,MATHEUS BUSTAMANTE GOMES,25,Não eleito,mg
PEDRALVA,MARCOS BATISTA,44,Não eleito,mg
PEDRALVA,JOEL SILVA,13,Eleito,mg
PEDRAS DE MARIA DA CRUZ,RODRIGO ALEXANDRE FERNANDES,11,Não eleito,mg
PEDRAS DE MARIA DA CRUZ,HEIDER DA SILVA MENDES,20,Eleito,mg
PEDRINÓPOLIS,RAFAEL FERREIRA SILVA,55,Eleito,mg
PEDRINÓPOLIS,ANTONIO JOSE GUNDIM,11,Não eleito,mg
PEDRO LEOPOLDO,MÁRCIO ROGÉRIO DE SOUZA,13,Não eleito,mg
PEDRO LEOPOLDO,EMILIANO BRAGA DOS SANTOS,11,Eleito,mg
PEDRO LEOPOLDO,ANGELO TADEU VIANA PEREIRA,15,Não eleito,mg
PEDRO TEIXEIRA,REINALDO MANOEL DE OLIVEIRA,11,Eleito,mg
TOMBOS,TIAGO PEDROSA LAZZARONI DALPERIO,11,Eleito,mg
TOMBOS,LEZIANE MAZETTO DE OLIVEIRA GUIMARÃES,13,Não eleito,mg
TRÊS CORAÇÕES,MARCOS LÉLIS SANTOS DA SILVA,27,Não eleito,mg
TRÊS CORAÇÕES,DIMAS PEREIRA E ABRAHÃO,45,Eleito,mg
TRÊS CORAÇÕES,COSME FERREIRA DO NASCIMENTO,70,Não eleito,mg
TRÊS CORAÇÕES,WANDEIR REIS DO PRADO,22,Não eleito,mg
TRÊS CORAÇÕES,JOSÉ ALBERTO DE OLIVEIRA NADUR,13,Não eleito,mg
TRÊS CORAÇÕES,CLAUDINEI FERREIRA,15,Não eleito,mg
TRÊS CORAÇÕES,REINALDO VILELA PARANAÍBA FILHO,44,Não eleito,mg
TRÊS MARIAS,DANILO BARBOSA REZENDE,10,Eleito,mg
TRÊS MARIAS,ROMILDO PEREIRA SOUZA,33,Não eleito,mg
TRÊS MARIAS,IVELONY CAMPOS ZILMAR DO NASCIMENTO,44,Não eleito,mg
TRÊS MARIAS,CLEBERSON CARLOS DE OLIVEIRA,20,Não eleito,mg
TRÊS MARIAS,SEBASTIÃO DA FONSECA LEAL,13,Não eleito,mg
TRÊS MARIAS,GABRIEL FERRÃO PEDROSO E SOUZA,25,Não eleito,mg
TRÊS PONTAS,PAULO LUIS RABELLO,22,Não eleito,mg
TRÊS PONTAS,MAICO DO NASCIMENTO CRISTO,33,Não eleito,mg
TRÊS PONTAS,LUIS CARLOS DA SILVA,55,Eleito,mg
TRÊS PONTAS,JOSÉ GERALDO VINHAS FERREIRA,20,Não eleito,mg
TUMIRITINGA,NILSON GUIMARÃES,15,Eleito,mg
TUMIRITINGA,LUSMAR BISPO,55,Não eleito,mg
TUPACIGUARA,FRANCISCO LOURENÇO BORGES NETO,45,Eleito,mg
TUPACIGUARA,CARLOS ALVES DE OLIVEIRA,77,Não eleito,mg
TURMALINA,OSVALDO FERREIRA DE ARAUJO,12,Não eleito,mg
TURMALINA,ZILMAR PINHEIRO LOPES,55,Eleito,mg
TURVOLÂNDIA,JOSE NELSON MARTINS,15,Eleito,mg
TURVOLÂNDIA,REGIANE CRISTINA DA SILVA,44,Não eleito,mg
UBAPORANGA,GLEYDSON DELFINO FERREIRA,55,Eleito,mg
UBAPORANGA,FLAVIO DE ASSIS RODRIGUES,23,Não eleito,mg
UBAÍ,MARCO ANTONIO ANDRADE,44,Não eleito,mg
UBAÍ,FARLEY VIEIRA RIBEIRO,25,Eleito,mg
UBERABA,ANDERSON ADAUTO PEREIRA,43,Não eleito,mg
UBERABA,PAULO PIAU NOGUEIRA,45,Não eleito,mg
UBERABA,ADRIANO ESPINDOLA CAVALHEIRO RODRIGUES,16,Não eleito,mg
UBERABA,ELISA GONÇALVES DE ARAÚJO,55,2º turno,mg
UBERABA,ANTONIO CARLOS SILVA NUNES,15,2º turno,mg
UBERABA,SAMIR CECÍLIO FILHO,22,Não eleito,mg
UBERLÂNDIA,DANDARA TONANTZIN SILVA CASTRO,13,Não eleito,mg
UBERLÂNDIA,LEONIDIO HENRIQUE CORREA BOUÇAS,45,Não eleito,mg
UBERLÂNDIA,GILBERTO ADENIÊ CUNHA,16,Não eleito,mg
UBERLÂNDIA,PAULO SÉRGIO FERREIRA,11,Eleito,mg
UBERLÂNDIA,DAPHINY OLIVEIRA COSTA SILVA,28,Não eleito,mg
UBÁ,MONICA VALLONE ESPOSITO MARCHI,44,Não eleito,mg
UBÁ,ROGERIO FERREIRA DA SILVA,12,Não eleito,mg
UBÁ,PAULO ROBERTO VELOSO,13,Não eleito,mg
UBÁ,JOSE DAMATO NETO,55,Eleito,mg
UMBURATIBA,AÉCIO CARLOS RIBEIRO NETO,70,Não eleito,mg
UMBURATIBA,JOÃO BATISTA SILVA OLIVEIRA,13,Eleito,mg
UNAÍ,THIAGO MARTINS RODRIGUES,22,Eleito,mg
UNAÍ,ALINO PEREIRA COELHO,45,Não eleito,mg
UNAÍ,RAFHAEL DE PAULO PEREIRA,30,Não eleito,mg
UNAÍ,FRANCISCO CARLOS DE SÁ FREITAS,43,Não eleito,mg
UNAÍ,ANDRÉA DE FÁTIMA MACHADO ADJUTO,25,Não eleito,mg
UNAÍ,CALIXTO ABADIA MARTINS NETO,40,Não eleito,mg
UNIÃO DE MINAS,REYTON CLEY FREITAS LEAL,44,Não eleito,mg
UNIÃO DE MINAS,ANDREIA OLIVEIRA MEDEIROS DE SAMPAIO,55,Não eleito,mg
UNIÃO DE MINAS,GEOVA TOMAZ DE ALMEIDA,77,Eleito,mg
URUANA DE MINAS,TÂNIA MENEZES LEPESQUEUR,15,Não eleito,mg
URUANA DE MINAS,BRUNO RAPHAEL MOTA FERREIRA,77,Eleito,mg
URUCUIA,JOSÉ AILSON DANTAS QUEIROZ,15,Eleito,mg
URUCUIA,MARCELO RODRIGUES DOS SANTOS,45,Não eleito,mg
URUCÂNIA,IVAN ROBERTO DE ARAÚJO,70,Não eleito,mg
URUCÂNIA,SERGIO LUIZ DE ALBUQUERQUE,11,Eleito,mg
URUCÂNIA,MARCUS VINICIUS LEAL HENRIQUE,45,Não eleito,mg
VARGEM ALEGRE,REGINALDO FRANCO DA SILVEIRA,45,Não eleito,mg
VARGEM ALEGRE,MARIA CECILIA DA COSTA GARCIA,55,Eleito,mg
VARGEM BONITA,JOSE GARCIA DE FARIA,45,Eleito,mg
VARGEM GRANDE DO RIO PARDO,JESUINO FERREIRA DE SOUZA,70,Não eleito,mg
VARGEM GRANDE DO RIO PARDO,GABRIEL ARCANJO BRAZ,15,Eleito,mg
VARGINHA,ZACARIAS ABRÃO PIVA,22,Não eleito,mg
VARGINHA,LEONARDO VINHAS CIACCI,55,Eleito,mg
VARGINHA,FABIANO GENEROSO DE ALMEIDA,43,Não eleito,mg
VARJÃO DE MINAS,TEREZINHA SILVERIO DE MELO,15,Não eleito,mg
VARJÃO DE MINAS,DANIEL LUIZ DE LIMA DOMINGOS,23,Não eleito,mg
VARJÃO DE MINAS,RAFAEL COSTA DE TONI,22,Eleito,mg
VARZELÂNDIA,MURILO DE JESUS GONÇALVES,15,Não eleito,mg
VARZELÂNDIA,AMANCIO OLIVA NETO,40,Eleito,mg
VAZANTE,DÉBORA ANDRADE RABELO GUIMARÂES,30,Não eleito,mg
VAZANTE,GABRIEL AFRANIO ROSA DE FARIA BARRA,55,Eleito,mg
VAZANTE,JOSÉ BENEDITO DOS REIS CALÇADO,77,Não eleito,mg
VERDELÂNDIA,RANDERSON DIEGO SILVA LEITE,70,Não eleito,mg
VERDELÂNDIA,WILTON LEITE MADUREIRA,13,Eleito,mg
VEREDINHA,NEREU AQUILES CORDEIRO MACHADO,45,Eleito,mg
VEREDINHA,HAMILTON FERNANDES MACEDO,12,Não eleito,mg
VERMELHO NOVO,GERALDO JOSÉ DO CARMO,40,Não eleito,mg
VERMELHO NOVO,CLÉCIUS VINICIUS PINTO,25,Eleito,mg
VERÍSSIMO,MARCO AURELIO DOS SANTOS HORTENCIO,11,Eleito,mg
VERÍSSIMO,ADALBERTO LUIS DA COSTA,43,Não eleito,mg
VERÍSSIMO,REINALDO SEBASTIÃO ALVES,45,Não eleito,mg
VESPASIANO,JOSE WINSTON DA SILVA,45,Eleito,mg
VESPASIANO,MARTA CARVALHO MURTA,55,Não eleito,mg
VESPASIANO,DADSON LEMOS FIAL,22,Não eleito,mg
VESPASIANO,EDINALDO SOARES DE SOUZA,13,Não eleito,mg
VIEIRAS,ALEX AUGUSTO MARTINS DA SILVEIRA,12,Não eleito,mg
VIEIRAS,RICARDO CELLES MAIA,55,Eleito,mg
VIRGEM DA LAPA,JEFERSON SÁVIO XAVIER DE SOUZA,10,Não eleito,mg
VIRGEM DA LAPA,VALDOMIRO SILVA COSTA NETO,55,Não eleito,mg
VIRGEM DA LAPA,AVERALDO MOREIRA MARTINS,13,Eleito,mg
VIRGINÓPOLIS,ALEX BATISTA COELHO,33,Não eleito,mg
VIRGINÓPOLIS,BRUNNA BASTOS SOARES,12,Não eleito,mg
VIRGINÓPOLIS,JOSUÉ ARRUDA DOS SANTOS,10,Eleito,mg
VIRGOLÂNDIA,JOSE ISMAR DE ASSIS NETO,15,Eleito,mg
VIRGOLÂNDIA,GERALDO MAGELA BORGES,45,Não eleito,mg
VIRGÍNIA,BRUNO RIBEIRO NEGREIROS,55,Eleito,mg
VIRGÍNIA,THIAGO PIMENTEL VIEIRA RICARDO,70,Não eleito,mg
VISCONDE DO RIO BRANCO,IRAN SILVA COURI,13,Não eleito,mg
VISCONDE DO RIO BRANCO,LUIZ FABIO ANTONUCCI FILHO,10,Eleito,mg
VIÇOSA,GLAUCO RODRIGUES DE PAULA,18,Não eleito,mg
VIÇOSA,HELIO MALTARO BARBOSA,22,Não eleito,mg
VIÇOSA,RAIMUNDO NONATO CARDOSO,55,Não eleito,mg
VIÇOSA,SÁVIO JOSÉ DO CARMO SILVA,13,Não eleito,mg
VIÇOSA,ANGELO CHEQUER,44,Eleito,mg
VOLTA GRANDE,LEANDRO LUIZ DE SOUZA MAGALHÃES,13,Não eleito,mg
VOLTA GRANDE,IVAN SOARES PULLIG,25,Eleito,mg
VÁRZEA DA PALMA,RODRIGO AGUIAR DALLA BERNARDINA,20,Eleito,mg
VÁRZEA DA PALMA,EDUARDO MONTEIRO DE ABREU,11,Não eleito,mg
WENCESLAU BRAZ,EDVALDO JOSÉ BITENCOURT,15,Eleito,mg
WENCESLAU BRAZ,WALDECYR SANTANA DA SILVA,55,Não eleito,mg
ÁGUA BOA,MILTON EDUARDO ALVES FILHO,11,Não eleito,mg
ÁGUA BOA,ORLANDO CARDOSO PEREIRA,77,Eleito,mg
ÁGUA BOA,ELZITO ROCHA DA COSTA,36,Não eleito,mg
ÁGUA COMPRIDA,GUSTAVO DE ALMEIDA GONÇALVES,55,Eleito,mg
ÁGUA COMPRIDA,JOSE OSCAR SILVA,25,Não eleito,mg
ÁGUA COMPRIDA,ALEXANDRE DE ALMEIDA SILVA,45,Não eleito,mg
ÁGUAS FORMOSAS,CARLOS SOUZA,30,Eleito,mg
ÁGUAS FORMOSAS,FORLAN SOUZA FREITAS,13,Não eleito,mg
ÁGUAS FORMOSAS,FELIPE CURY ABRANTES,10,Não eleito,mg
ÁGUAS VERMELHAS,NILSON FRANCISCO CAMPOS,70,Eleito,mg
ÁGUAS VERMELHAS,VALDECY JOSE DE SOUZA,15,Não eleito,mg
ABATIÁ,SONIA APARECIDA DE SOUZA CHAVES,44,Eleito,pr
ABATIÁ,EMMANUEL LIBERATO MUZEL,15,Não eleito,pr
ABATIÁ,JOSIANE CRISTINA DOS SANTOS,13,Não eleito,pr
ADRIANÓPOLIS,VANDIR DE OLIVEIRA ROSA,55,Eleito,pr
ADRIANÓPOLIS,ROBSON TARCIS JEREMIAS DOS SANTOS,11,Não eleito,pr
AGUDOS DO SUL,JAIR BATISTA DE SOUZA,20,Não eleito,pr
AGUDOS DO SUL,DIEGO LUIZ TEIXEIRA,15,Não eleito,pr
AGUDOS DO SUL,GENEZIO GONÇALVES DA LUZ,22,Eleito,pr
ALMIRANTE TAMANDARÉ,ROMILDO SEBASTIÃO DE BRITO,70,Não eleito,pr
ALMIRANTE TAMANDARÉ,ALFREDO BURZYNSKI,50,Não eleito,pr
ALMIRANTE TAMANDARÉ,GIVANILDO JOSÉ DA SILVA,35,Não eleito,pr
ALMIRANTE TAMANDARÉ,JUCIE PARREIRA DOS SANTOS,13,Não eleito,pr
ALMIRANTE TAMANDARÉ,FERNANDO AUGUSTO TANCK,77,Não eleito,pr
ALMIRANTE TAMANDARÉ,CAMILO DANIEL LOVATO,15,Eleito,pr
ALTAMIRA DO PARANÁ,JOSÉ ETEVALDO DE OLIVEIRA,13,Não eleito,pr
ALTAMIRA DO PARANÁ,ELZA APARECIDA DA SILVA,55,Eleito,pr
ALTO PARANÁ,ROSIVALDO DA SILVA,22,Não eleito,pr
ALTO PARANÁ,CLAUDEMIR JOIA PEREIRA,44,Eleito,pr
ALTO PARANÁ,EVERTON RONCAGLIO,55,Não eleito,pr
ALTO PARAÍSO,LUCINEIA CARVALHO QUEIROZ DE OLIVEIRA,15,Não eleito,pr
ALTO PARAÍSO,PEDRO RUI PAGANI,11,Não eleito,pr
ALTO PARAÍSO,LUIZ ELISEU DOS SANTOS,44,Eleito,pr
ALTO PIQUIRI,ELIAS PEREIRA DA SILVA,44,Não eleito,pr
ALTO PIQUIRI,JOSÉ ANTÔNIO COSTA,13,Não eleito,pr
ALTO PIQUIRI,GIOVANE MENDES DE CARVALHO,55,Eleito,pr
ALTÔNIA,JOÃO PEDRO BULIANI DA MATA,11,Não eleito,pr
ALTÔNIA,DIEGO JARDIM PERGO,22,Eleito,pr
ALVORADA DO SUL,BRUNO LEONARDO FREIRE DE ALENCAR,40,Não eleito,pr
ALVORADA DO SUL,MARCOS ANTONIO GASPARELLI,55,Eleito,pr
AMAPORÃ,TEREZINHA FUMIKO YAMAKAWA,44,Não eleito,pr
AMAPORÃ,RICARDO RODRIGUES MARTINS,77,Não eleito,pr
AMAPORÃ,GILMAR ADRIANO BASILIO OLIVEIRA,15,Não eleito,pr
AMAPORÃ,MARCOS MARIN,11,Eleito,pr
AMPÉRE,DOUGLAS DIEMS MOROCKOSKI POTRICH,11,Eleito,pr
AMPÉRE,JEFERSON DO NASCIMENTO LOURENSSI,12,Não eleito,pr
ANAHY,ODAIR VIEIRA DE MIRANDA,13,Não eleito,pr
ANAHY,ARILSON BATISTA DE SOUZA,55,Eleito,pr
ANDIRÁ,VALDEMIR APARECIDO DOS SANTOS,11,Não eleito,pr
ANDIRÁ,CELIO DE CASTRO,13,Não eleito,pr
ANDIRÁ,ANDRE ANDERSON ROSSATO,22,Não eleito,pr
ANDIRÁ,BRUNO GARCIA DUTRA,44,Não eleito,pr
ANDIRÁ,EDNYRA APARECIDA SANCHES BUENO DE GODOY FERREIRA,55,Eleito,pr
ANTONINA,DAVID PINHEIRO LIMA COUTO,12,Não eleito,pr
ANTONINA,JEFFERSON OLIVEIRA FONSECA,20,Não eleito,pr
ANTONINA,ROZANE MARISTELA BENEDETTI OSAKI,55,Eleito,pr
ANTONINA,MUNIRA PELUSO,10,Não eleito,pr
ANTÔNIO OLINTO,GILCIANO MOREIRA,22,Não eleito,pr
ANTÔNIO OLINTO,FABIO STANISZEWSKI MACHIAVELLI,11,Eleito,pr
ANTÔNIO OLINTO,ALAN JAROS,55,Não eleito,pr
ANTÔNIO OLINTO,MARIO PASCOAL DOLINSKI,13,Não eleito,pr
APUCARANA,JANIEIRE MARIA DOS REIS,13,Não eleito,pr
APUCARANA,RODRIGO LAUER LIEVORE,15,Não eleito,pr
APUCARANA,RODOLFO MOTA DA SILVA,44,Eleito,pr
APUCARANA,PAULO SERGIO VITAL,22,Não eleito,pr
ARAPONGAS,JAIR MILANI,22,Não eleito,pr
ARAPONGAS,RAFAEL FELIPE CITA,55,Eleito,pr
ARAPOTI,JOAO ATAIR ALBERTTI,22,Não eleito,pr
ARAPOTI,NERILDA APARECIDA PENNA,11,Não eleito,pr
ARAPOTI,IRANI JOSE BARROS,55,Eleito,pr
ARAPUÃ,SOELI DE SOUZA,15,Não eleito,pr
ARAPUÃ,MANOEL SALVADOR,45,Eleito,pr
ARARUNA,GUSTAVO FRANÇA DOS SANTOS,10,Eleito,pr
ARAUCÁRIA,MARJORIE LOUISE FERREIRA DE SOUZA,15,Não eleito,pr
ARAUCÁRIA,ALBANOR JOSE FERREIRA GOMES,20,Não eleito,pr
ARAUCÁRIA,JULIANO BORGHETTI,11,Não eleito,pr
ARAUCÁRIA,LUIZ GUSTAVO BOTOGOSKI,22,Eleito,pr
ARAUCÁRIA,CLAUDIO BEDNARCZUK,44,Não eleito,pr
ARAUCÁRIA,GENILDO PEREIRA CARVALHO,23,Não eleito,pr
ARAUCÁRIA,IRINEU CANTADOR,27,Não eleito,pr
ARAUCÁRIA,FABIO ALCEU FERNANDES,40,Não eleito,pr
ARAUCÁRIA,SAMUEL ALMEIDA DA SILVA,13,Não eleito,pr
ARAUCÁRIA,RAFAEL DANTAS,25,Não eleito,pr
ARIRANHA DO IVAÍ,NELSON BANDIERA DE MATTOS,23,Não eleito,pr
ARIRANHA DO IVAÍ,THIAGO EPIFANIO DA SILVA,55,Eleito,pr
ASSAÍ,MICHEL ANGELO BOMTEMPO,55,Eleito,pr
ASSAÍ,ANTONIO MENEGILDO GAVIÃO MANOEL,15,Não eleito,pr
ASSAÍ,ILDENEY MOLIN,25,Não eleito,pr
ASSAÍ,IZAIAS FIDELIS,11,Não eleito,pr
ASSAÍ,EDUARDO ANTONIO GUADAGNIN DOS SANTOS,13,Não eleito,pr
ASSIS CHATEAUBRIAND,VICTOR AUGUSTO DO NASCIMENTO PESTANA,11,Não eleito,pr
ASSIS CHATEAUBRIAND,MARCEL HENRIQUE MICHELETTO,22,Eleito,pr
ASTORGA,SUZIE APARECIDA PUCILLO ZANATTA,11,Eleito,pr
ASTORGA,CHARLES WESLEI GASPARINO,40,Não eleito,pr
ASTORGA,ARQUIMEDES ZIROLDO,22,Não eleito,pr
ATALAIA,CARLOS EDUARDO ARMELIN MARIANI,55,Eleito,pr
BALSA NOVA,ANTÔNIO CARLOS SALMOREA,28,Não eleito,pr
BALSA NOVA,ENILSON JURUPUAN DOS SANTOS,65,Não eleito,pr
BALSA NOVA,CLEVER APARECIDO IAVOLSKI POLETTO,22,Eleito,pr
BALSA NOVA,MARCOS ANTONIO ZANETTI,55,Não eleito,pr
BANDEIRANTES,VALQUIRIA APARECIDA BONACINI MARTINS,25,Não eleito,pr
BANDEIRANTES,JOSÉ FERNANDES DA SILVA JÚNIOR,55,Não eleito,pr
BANDEIRANTES,JAELSON RAMALHO MATTA,22,Eleito,pr
BANDEIRANTES,SIDNEI DEMICIO,77,Não eleito,pr
BARBOSA FERRAZ,DEBORA CAROLINE CARVALHO,44,Não eleito,pr
BARBOSA FERRAZ,CARLOS ROSA ALVES,55,Eleito,pr
BARBOSA FERRAZ,MARINALVA DIAS CARVALHO,11,Não eleito,pr
BARRA DO JACARÉ,LUIZ FABIANO ZANATTA,12,Eleito,pr
BARRA DO JACARÉ,EDIMAR DE FREITAS ALBONETI,11,Não eleito,pr
BARRACÃO,MARCO AURÉLIO ZANDONÁ,15,Não eleito,pr
BARRACÃO,JORGE LUIZ SANTIN,55,Eleito,pr
BELA VISTA DA CAROBA,GELSON MAFFI,55,Eleito,pr
BELA VISTA DO PARAÍSO,FABRICIO PASTORE,22,Eleito,pr
BITURUNA,MARCOS BERTOLETTI,12,Não eleito,pr
BITURUNA,NELSON LIBER,13,Não eleito,pr
BITURUNA,RODRIGO ROSSONI,45,Eleito,pr
BOA ESPERANÇA,REINALDO JOSE DA COSTA,22,Não eleito,pr
BOA ESPERANÇA,JOEL CELSO BUSCARIOL,15,Eleito,pr
BOA ESPERANÇA DO IGUAÇU,GIVANILDO TRUMI,11,Eleito,pr
BOA ESPERANÇA DO IGUAÇU,JOSIR BÉRGAMO,20,Não eleito,pr
BOA VENTURA DE SÃO ROQUE,ADILSON ROQUE DOS SANTOS,55,Não eleito,pr
BOA VENTURA DE SÃO ROQUE,NESTOR KENEAR,15,Eleito,pr
BOA VENTURA DE SÃO ROQUE,ELIZEU CABRAL,11,Não eleito,pr
BOA VISTA DA APARECIDA,CLEIDE TERESINHA DOS SANTOS,13,Não eleito,pr
BOA VISTA DA APARECIDA,EDUARDO JOSE HENRICHS,55,Eleito,pr
BOCAIÚVA DO SUL,JOAO DE LIMA,55,Eleito,pr
BOCAIÚVA DO SUL,CARLOS ROBERTO TAVERNA DA FONSECA,11,Não eleito,pr
BOCAIÚVA DO SUL,KLEBER ALVARENGA BERTI,22,Não eleito,pr
BOM JESUS DO SUL,MARCOS ADRIANO LOPES DIAS,13,Não eleito,pr
BOM JESUS DO SUL,HELIO JOSE SURDI,11,Eleito,pr
BOM SUCESSO,ROSANA FERREIRA LOPES,10,Eleito,pr
BOM SUCESSO,JOSE ROBERTO DA SILVA,11,Não eleito,pr
BOM SUCESSO,BERNABE RIBEIRO,12,Não eleito,pr
BOM SUCESSO DO SUL,SILVIO STDNIK,22,Não eleito,pr
BOM SUCESSO DO SUL,MAICO DIOGO FAVERSANI,55,Eleito,pr
BORRAZÓPOLIS,ADILSON LUCCHETTI,40,Eleito,pr
BORRAZÓPOLIS,DALTON FERNANDES MOREIRA,55,Não eleito,pr
BORRAZÓPOLIS,CARLOS EDUARDO DOS SANTOS,11,Não eleito,pr
BORRAZÓPOLIS,HÉLIO GONÇALVES DE CARVALHO,27,Não eleito,pr
BRAGANEY,SALETE JACI DA SILVA SCHMITT FRISON,15,Não eleito,pr
BRAGANEY,VALDIR ZIELINSKI,55,Eleito,pr
BRAGANEY,JONECI MORAES DE LIMA,13,Não eleito,pr
BRASILÂNDIA DO SUL,ALEX ANTONIO CAVALCANTE,55,Eleito,pr
BRASILÂNDIA DO SUL,ROBERTO KIMIO KABAYASHI,22,Não eleito,pr
CAFEARA,ELTON FÁBIO LAZARETTI,25,Eleito,pr
CAFEARA,OSCIMAR JOSÉ SPERANDIO,55,Não eleito,pr
CAFEARA,JOELMIR BATISTA SOARES,13,Não eleito,pr
CAFELÂNDIA,JUNIOR MOTTER,30,Eleito,pr
CAFELÂNDIA,CULESTINO KIARA,22,Não eleito,pr
CAFELÂNDIA,ROSELI APARECIDA DECKEN,55,Não eleito,pr
CAFEZAL DO SUL,PEDRO MINORU INOUE,11,Eleito,pr
CAFEZAL DO SUL,ASCANIO ANTONIO DE PAULA,12,Não eleito,pr
CALIFÓRNIA,HUGO HENRIQUE BERNARDO,11,Não eleito,pr
CALIFÓRNIA,RIVELINO JOSE DE SOUZA,22,Não eleito,pr
CALIFÓRNIA,PAULO SÉRGIO CHILEIDE,45,Eleito,pr
CAMBARÁ,RAFFAELLO FRASCATI,40,Não eleito,pr
